,SearchTerm,BusinessName,UBINumber,BusinessId,Address,Status,address_match,ubi_match,id_match
0,HUDSON STREET LTD PARTNERSHIP,3109 HUDSON STREET LLC,604 200 845,1172636,"251 ELDORADO DR, LONGVIEW, WA, 98632-9369, UNITED STATES",Active,False,False,False
1,HUDSON STREET LTD PARTNERSHIP,3252 SOUTH HUDSON STREET LLC,604 170 639,63163,"4542 S. LUCILE ST, SEATTLE, WA, 98118, UNITED STATES",Active,False,False,False
2,HUDSON STREET LTD PARTNERSHIP,"HUDSON 1099 STEWART STREET, LLC",604 037 980,155001,"11601 WILSHIRE BOULEVARD, NINTH FLOOR, LOS ANGELES, CA, 90025, UNITED STATES",Active,False,False,False
3,HUDSON STREET LTD PARTNERSHIP,HUDSON STREET INVESTMENTS LLC,602 385 818,238635,"88 S HUDSON ST, SEATTLE, WA, 98134-2421, UNITED STATES",Active,False,False,False
4,HUDSON STREET LTD PARTNERSHIP,HUDSON STREET LLC,602 029 537,155062,"5005 3RD AVE S, SEATTLE, WA, 98134, UNITED STATES",Active,False,False,False
5,HUDSON STREET LTD PARTNERSHIP,"HUDSON STREET MANAGER, LLC",602 634 552,748555,"5005 3RD AVE S, SEATTLE, WA, 98134-2423, UNITED STATES",Active,False,False,False
6,HUDSON STREET LTD PARTNERSHIP,"HUDSON STREET PROPERTIES, LTD.",601 845 359,741643,,Inactive,False,False,False
7,HUDSON STREET LTD PARTNERSHIP,"HUDSON STREET SPE, LLC",602 634 550,733107,"5005 3RD AVE S, PO BOX 24567, SEATTLE, WA, 98124, UNITED STATES",Active,False,False,False
8,JPPF HPC L P,"JPPF HPC GP, LLC",604 800 670,1490927,"675 PONCE DE LEON AVE NE FL 7, ATLANTA, GA, 30308-1884, UNITED STATES",Active,True,False,False
9,JPPF HPC L P,"JPPF HPC, L.P.",604 806 425,1490951,"675 PONCE DE LEON AVE NE FL 7, ATLANTA, GA, 30308-1884, UNITED STATES",Active,True,False,False
10,SEATTLE LABOR TEMPLE ASSOCIATION INC,"THE SEATTLE LABOR TEMPLE ASSOCIATION, INC.",601 114 372,1039947,"21400 INTERNATIONAL BLVD, STE 205, SEATAC, WA, 98198-6086, UNITED STATES",Active,False,False,False
11,SPIRE 1550 4TH AVE LP,SPIRE 1550 4TH AVENUE LP,603 606 900,996291,"600 UNIVERSITY ST, SUITE 2310, SEATTLE, WA, 98101-4112, UNITED STATES",Active,False,False,False
12,TLC PROPERTIES INC,TLC ESTATE PROPERTIES LLC,602 871 036,1046735,"1815 121ST AVE SE, BELLEVUE, WA, 98005, UNITED STATES",Active,False,False,False
13,TLC PROPERTIES INC,"TLC PROPERTIES NW, LLC",602 827 659,485340,"5612 W REGINA LN, SPOKANE, WA, 99208-7803, UNITED STATES",Active,False,False,False
14,TLC PROPERTIES INC,"TLC PROPERTIES, INC.",601 875 242,1013638,,,True,True,True
15,TLC PROPERTIES INC,"TLC PROPERTIES, LLC",601 875 242,1013638,"5321 CORPORATE BLVD, BATON ROUGE, LA, 70808-2506, UNITED STATES",Active,False,True,True
16,TLC PROPERTIES INC,"TLC PROPERTIES-USA, LLC",601 919 510,1013639,,Terminated,True,False,False
17,HARBOR REAL ESTATE INVESTMENTS,"HARBOR REAL ESTATE INVESTMENTS, INC.",601 424 758,215326,"1131 SW KLICKITAT WAY, ATTN: CANDICE M. WOODS, SEATTLE, WA, 98134-1108, UNITED STATES",Active,False,False,False
18,PORT OF SEATTLE,"AN F. IMPORTS OF SEATTLE, INC.",603 089 170,31664,"200 SW 1ST AVE 14TH FL, FORT LAUDERDALE, FL, 33301, UNITED STATES",Terminated,False,False,False
19,PORT OF SEATTLE,"AN IMPORTS OF SEATTLE, INC.",603 018 880,550308,"200 SW 1ST AVE, FT LAUDERDALE, FL, 33301, UNITED STATES",Active,False,False,False
20,PORT OF SEATTLE,INDO-AMERICAN  SPORTS CLUB OF SEATTLE,604 788 866,1480407,"11804 SE 218TH PL, KENT, WA, 98031-9697, UNITED STATES",Active,False,False,False
21,PORT OF SEATTLE,PORT OF SEATTLE FIREFIGHTERS DIVERSITY ASSOCIATION,603 078 895,380540,"2400 S 170TH ST, SEATAC, WA, 98158-1112, UNITED STATES",Administratively Dissolved,False,False,False
22,PORT OF SEATTLE,PORTABLE POWER OF SEATTLE INC.,604 574 427,1337669,,Administratively Dissolved,False,False,False
23,PORT OF SEATTLE,"PROPELLER CLUB OF THE UNITED STATES, PORT OF SEATTLE",604 755 313,1454550,"100 W HARRISON ST STE S560, SEATTLE, WA, 98119-4162, UNITED STATES",Active,False,False,False
24,PORT OF SEATTLE,"THE NATIONAL MANAGEMENT ASSOCIATION, PORT OF SEATTLE CHAPTER",601 490 891,1020015,"2711 ALASKAN WAY, SEATTLE, WA, 98121-1107, UNITED STATES",Active,False,False,False
25,PORT OF SEATTLE,THE PORT OF SEATTLE POLICE DEPARTMENT BENEVOLENT ASSOCIATION,601 157 844,475055,"17801 PACIFIC HWY S, SEATAC, WA, 98158-1202, UNITED STATES",Delinquent,False,False,False
26,PORT OF SEATTLE,THE TRANSPORTATION CLUB OF SEATTLE,601 132 929,477237,"15008 88TH ST E, PUYALLUP, WA, 98372-4470, UNITED STATES",Active,False,False,False
27,PORT OF SEATTLE,UNITED PORT MINISTRIES OF SEATTLE,602 358 265,1060005,"3568 W MARGINAL WAY SW, SEATTLE, WA, 98106, UNITED STATES",Administratively Dissolved,False,False,False
28,PORT OF SEATTLE,VIETNAMESE COMMUNITY FOR MUTUAL SUPPORT OF SEATTLE - VAN THOTUONG TE HOI,603 446 832,503989,"5124 NE 4TH CT, RENTON, WA, 98059-4566, UNITED STATES",Active,False,False,False
29,PORT OF SEATTLE,YOUNG PROFESSIONALS IN TRANSPORTATION OF SEATTLE,603 300 363,1082704,"709 BOYLSTON AVE E, APT 201, SEATTLE, WA, 98102-4682, UNITED STATES",Active,False,False,False
30,FIRST & UTAH PROPERTIES LLC,"FIRST AND UTAH PROPERTIES II, LLC",604 677 337,1405668,"2401 UTAH AVE S STE 305, SEATTLE, WA, 98134-1431, UNITED STATES",Active,False,False,False
31,FIRST & UTAH PROPERTIES LLC,"FIRST AND UTAH PROPERTIES, LLC",604 018 527,164541,"2401 UTAH AVE S STE 305, SEATTLE, WA, 98134, UNITED STATES",Active,False,False,False
32,LIBERTY RIDGE L L C,"LIBERTY CAPITAL BRIDGE MANAGEMENT, LLC",602 835 738,288147,"13206 NE 93RD ST, REDMOND, WA, 98052, UNITED STATES",Administratively Dissolved,True,False,False
33,LIBERTY RIDGE L L C,"LIBERTY CAPITAL BRIDGE, LLC",602 656 680,815865,"13206 NE 93RD ST, REDMOND, WA, 98052, UNITED STATES",Administratively Dissolved,True,False,False
34,LIBERTY RIDGE L L C,"LIBERTY RIDGE ADVISORS, LLC",604 174 761,830176,"500 UNION STREET, SUITE 1005, SEATTLE, WA, 98101, UNITED STATES",Active,False,False,False
35,LIBERTY RIDGE L L C,"LIBERTY RIDGE APARTMENTS, LLC",602 463 413,790764,"1000 2ND AVE, ATTN: KELLY NELSON, SEATTLE, WA, 98104-1022, UNITED STATES",Active,False,False,False
36,LIBERTY RIDGE L L C,"LIBERTY RIDGE CAPITAL, LLC",604 177 647,812856,"500 UNION ST, SUITE 1005, SEATTLE, WA, 98101-2363, UNITED STATES",Active,False,False,False
37,LIBERTY RIDGE L L C,"LIBERTY RIDGE EQUINE, LLC",604 327 036,1231555,"15309 SE 344TH ST, AUBURN, WA, 98092-3959, UNITED STATES",Administratively Dissolved,False,False,False
38,LIBERTY RIDGE L L C,LIBERTY RIDGE ESTATES HOMEOWNER ASSOCIATION,602 646 311,816033,"6408 179TH AVE E, LAKE TAPPS, WA, 98391-8976, UNITED STATES",Administratively Dissolved,False,False,False
39,LIBERTY RIDGE L L C,LIBERTY RIDGE HOMEOWNERS ASSOCIATION,602 007 997,191972,"716 W MEEKER ST STE 101, KENT, WA, 98032-5703, UNITED STATES",Active,False,False,False
40,LIBERTY RIDGE L L C,"LIBERTY RIDGE INVESTMENTS, LLC",604 707 175,1427149,"242 N LEGACY RIDGE DR, LIBERTY LAKE, WA, 99019-7631, UNITED STATES",Active,False,False,False
41,LIBERTY RIDGE L L C,LIBERTY RIDGE L.L.C.,602 026 276,302631,"5050 1ST AVE S STE 102, SEATTLE, WA, 98134-2400, UNITED STATES",Active,False,False,False
42,LIBERTY RIDGE L L C,LIBERTY RIDGE LAWNCARE INC.,603 291 911,296554,"229 FERNDALE AVE SE, RENTON, WA, 98056, UNITED STATES",Administratively Dissolved,False,False,False
43,LIBERTY RIDGE L L C,LIBERTY RIDGE OWNERS ASSOCIATION,604 984 176,1609865,,Active,False,False,False
44,LIBERTY RIDGE L L C,LIBERTY RIDGE PTO,601 859 320,811746,"12202 209TH AVENUE CT E, BONNEY LAKE, WA, 98391-7766, UNITED STATES",Active,False,False,False
45,LIBERTY RIDGE L L C,LIBERTY RIDGE WEST LLC,604 062 021,799455,"5050 1ST AVE # 102, SEATTLE, WA, 98134, UNITED STATES",Active,False,False,False
46,KEY MAC LLC,KEYMAC II LIMITED PARTNERSHIP,601 155 472,268280,,Inactive,True,False,False
47,KEY MAC LLC,"KEYMAC, L.L.C.",601 952 238,811044,"5005 3RD AVE S, SEATTLE, WA, 98134-2423, UNITED STATES",Active,False,False,False
48,KEY MAC LLC,KEYSTONE CHOICE PHARMACY LLC,604 101 775,795545,"432 CEDARVILLE RD, EASTON, PA, 18042-6907, UNITED STATES",Withdrawn,False,True,True
49,KEY MAC LLC,"KEYSTONE CHOICE PHARMACY, LLC",604 101 775,795545,,,True,True,True
50,KEY MAC LLC,MARKEY MACHINE LLC,604 963 185,1590870,"7266 8TH AVE S, SEATTLE, WA, 98108-3403, UNITED STATES",Active,True,False,False
51,KEY MAC LLC,MARKEY MACHINERY CO. INC.,178 001 978,807099,,,True,True,True
52,KEY MAC LLC,"MMACHINERY, INC.",178 001 978,807099,"7266 8TH AVE S, SEATTLE, WA, 98108-3403, UNITED STATES",Voluntarily Dissolved,True,True,True
53,B&E INVESTMENTS LLC,"""JACOBS PRIDE INVESTMENTS, A LIMITED PARTNERSHIP""",602 034 860,506,,Inactive,True,False,False
54,B&E INVESTMENTS LLC,100 BETHEL INVESTMENT PARTNERS LLC,604 312 409,1219989,"3711 SW FIRDRONA LN S, PORT ORCHARD, WA, 98367-6908, UNITED STATES",Active,False,False,False
55,B&E INVESTMENTS LLC,"101 KENWOOD, LLC",604 211 793,1176167,"101 KENWOOD ST, WALLA WALLA, WA, 99362-1627, UNITED STATES",Active,False,True,True
56,B&E INVESTMENTS LLC,12 BELLEVUE INTERNATIONAL INVESTMENT LLC,603 115 200,20960,"9809 NE 32ND ST, BELLEVUE, WA, 98004-1833, UNITED STATES",Active,False,False,False
57,B&E INVESTMENTS LLC,1201 S BAILEY INVESTMENTS LLC,604 051 907,1903,"801 BLANCHARD ST STE 400, SEATTLE, WA, 98121, UNITED STATES",Administratively Dissolved,False,False,False
58,B&E INVESTMENTS LLC,121 BEECH INVESTMENT COMPANY LLC,604 411 463,1270206,"701 5TH AVE STE 2460, SEATTLE, WA, 98104-7107, UNITED STATES",Active,False,False,False
59,B&E INVESTMENTS LLC,126 BLUE POOL INVESTMENTS INC.,604 763 988,1470850,"11120 EVERGREEN WAY STE C, EVERETT, WA, 98204-3888, UNITED STATES",Active,False,False,False
60,B&E INVESTMENTS LLC,"127 BELLEVUE INVESTMENTS, LLC",604 091 097,5582,"1926 QUEEN ANNE AVE N, SEATTLE, WA, 98109, UNITED STATES",Administratively Dissolved,False,False,False
61,B&E INVESTMENTS LLC,"18317 BOTHELL INVESTMENT PARTNERS, LLC",604 189 057,1166318,"18329 98TH AVE NE, SUITE 300, BOTHELL, WA, 98011, UNITED STATES",Active,False,False,False
62,B&E INVESTMENTS LLC,"2008 BABARE FAMILY INVESTMENTS, L.L.C.",602 857 330,66195,"6442 VIEW RIDGE DR, TACOMA, WA, 98407-1118, UNITED STATES",Voluntarily Dissolved,True,False,False
63,B&E INVESTMENTS LLC,20107 BOTHELL INVESTMENT LLC,604 815 570,1496616,"11410 NE 124TH ST # 500, KIRKLAND, WA, 98034-4305, UNITED STATES",Active,False,False,False
64,B&E INVESTMENTS LLC,2018 BABARE INVESTMENTS LLC,604 256 053,1209097,"6442 VIEW RIDGE DR, TACOMA, WA, 98407-1118, UNITED STATES",Voluntarily Dissolved,True,False,False
65,B&E INVESTMENTS LLC,2018 BEACH INVESTMENTS LLC,604 268 651,1199196,"950 PACIFIC AVE STE 1050, TACOMA, WA, 98402-4435, UNITED STATES",Active,False,False,False
66,B&E INVESTMENTS LLC,2018 TIMBERDOODLE COMPANY INVESTMENT GROUP LLC,604 376 741,1251736,"1510 E SPENCER LAKE RD, SHELTON, WA, 98584-9504, UNITED STATES",Active,False,False,False
67,B&E INVESTMENTS LLC,"321 BURNETT INVESTMENTS, LLC",602 399 945,63121,"12819 SE 38TH ST #23, BELLEVUE, WA, 98006, UNITED STATES",Voluntarily Dissolved,False,False,False
68,B&E INVESTMENTS LLC,"3B'S SERVICES & INVESTMENTS, LLC",604 997 120,1613198,"38275 STATE ROUTE 25 N, DAVENPORT, WA, 99122-9384, UNITED STATES",Active,False,False,False
69,B&E INVESTMENTS LLC,3RD & BELL INVESTMENT LLC,602 633 905,62321,"1530 33RD AVE S, SEATTLE, WA, 98144, UNITED STATES",Administratively Dissolved,False,False,False
70,B&E INVESTMENTS LLC,5 BARREL INVESTMENTS LLC,602 992 064,344678,"2518 SILVES CRT, EVERSON, WA, 98247, UNITED STATES",Administratively Dissolved,False,False,False
71,B&E INVESTMENTS LLC,A BETTER LIVING FAMILY INVESTMENT INC,603 518 527,390993,"2508 NW 202ND ST, SHORELINE, WA, 98177-2428, UNITED STATES",Voluntarily Dissolved,False,False,False
72,B&E INVESTMENTS LLC,"A.S. BUSINESS INVESTMENTS, INC.",602 711 290,457791,"710 SW 34TH ST, RENTON, WA, 98057-4816, UNITED STATES",Administratively Dissolved,False,False,False
73,B&E INVESTMENTS LLC,AA NOBLE INVESTMENTS LLC,603 270 063,13903,"3225 MCLEOD DR STE 100, LAS VEGAS, NV, 89121-2257, UNITED STATES",Active,True,False,False
74,B&E INVESTMENTS LLC,AB REAL ESTATE INVESTMENTS LLC,603 272 091,12404,"6351 36TH AVE SW, SEATTLE, WA, 98126-3009, UNITED STATES",Administratively Dissolved,False,False,False
75,B&E INVESTMENTS LLC,ABC REAL ESTATE INVESTMENT LLC,603 410 577,329820,"803 S 38TH CT, RENTON, WA, 98055-5895, UNITED STATES",Active,False,False,False
76,B&E INVESTMENTS LLC,"ABEJA INVESTMENT, LLC",604 253 664,1197375,"2200 ALASKAN WAY STE 200, SEATTLE, WA, 98121-3602, UNITED STATES",Active,False,False,False
77,B&E INVESTMENTS LLC,ABENROTH INVESTMENTS INC.,602 530 837,475411,"9545 2ND AVE NW, SEATTLE, WA, 98117-2014, UNITED STATES",Active,False,False,False
78,B&E INVESTMENTS LLC,ABERDEEN STANDARD INVESTMENTS INC.,603 605 151,1249067,,,True,True,True
79,B&E INVESTMENTS LLC,"ABERT INVESTMENT, LLC",602 883 903,21006,"3400 MOUNT ANDERSON CT, WEST RICHLAND, WA, 99353-7336, UNITED STATES",Active,True,False,False
80,B&E INVESTMENTS LLC,ABIDE ALLEY INVESTMENTS LLC,604 800 582,1490818,"9433 11TH AVE SW, SEATTLE, WA, 98106-2907, UNITED STATES",Active,False,False,False
81,B&E INVESTMENTS LLC,"ABILENE INVESTMENTS, LLC",602 651 805,352084,"40605 NE 186TH AVE, AMBOY, WA, 98601-3725, UNITED STATES",Active,False,False,False
82,B&E INVESTMENTS LLC,"ABLE INVESTMENTS, LLC",602 849 068,13366,"10608 STEELE ST E, BLDG C, STE B, LAKEWOOD, WA, 98499, UNITED STATES",Administratively Dissolved,False,False,False
83,B&E INVESTMENTS LLC,"ABLE PROPERTY INVESTMENTS, INC.",603 163 354,1093370,"1204 N 10TH PL, APT #2239, RENTON, WA, 98057-5661, UNITED STATES",Active,False,False,False
84,B&E INVESTMENTS LLC,"ABODE INVESTMENT GROUP, LLC",603 562 833,476601,"18313 133RD ST E, BONNEY LAKE, WA, 98391, UNITED STATES",Active,False,False,False
85,B&E INVESTMENTS LLC,ABODE INVESTMENT LLC,603 406 482,16351,"PO BOX 257, OLYMPIA, WA, 98507-0257, UNITED STATES",Administratively Dissolved,True,False,False
86,B&E INVESTMENTS LLC,ABODE REAL ESTATE INVESTMENTS LLC,603 425 788,446013,"6516 41ST AVE SW, SEATTLE, WA, 98136-1814, UNITED STATES",Active,False,False,False
87,B&E INVESTMENTS LLC,ABOSSEIN INVESTMENTS LLC,602 653 233,12946,"18465 NE 68TH ST, REDMOND, WA, 98052-3325, UNITED STATES",Active,False,False,False
88,B&E INVESTMENTS LLC,"ABQ CARLISLE INVESTMENTS, LLC",603 269 684,446027,,Administratively Dissolved,True,False,False
89,B&E INVESTMENTS LLC,ABRDN INC.,603 605 151,1249067,"1900 MARKET ST STE 200, PHILADELPHIA, PA, 19103-3527, UNITED STATES",Active,False,True,True
90,B&E INVESTMENTS LLC,ABREGO KING INVESTMENTS LLC,604 587 243,1344919,"1307 SW 4TH ST, COLLEGE PLACE, WA, 99324-1272, UNITED STATES",Voluntarily Dissolved,False,False,False
91,B&E INVESTMENTS LLC,ABSOLUTE INVESTMENTS INC,603 244 225,13706,"4816 AURORA AVE N, SEATTLE, WA, 98103, UNITED STATES",Administratively Dissolved,False,False,False
92,B&E INVESTMENTS LLC,"ABSOLUTE RESOLUTIONS INVESTMENTS, LLC",603 598 741,1093440,"8000 NORMAN CENTER DR, STE. 350, BLOOMINGTON, MN, 55437-1118, UNITED STATES",Active,False,False,False
93,B&E INVESTMENTS LLC,"ABSOLUTE RETURN INVESTMENT SOLUTIONS, LLC",603 343 186,365817,"16310 NE 80TH ST STE 100, REDMOND, WA, 98052, UNITED STATES",Administratively Dissolved,False,False,False
94,B&E INVESTMENTS LLC,"ABUELOS INVESTMENTS, LLC",603 331 892,17683,"3821 LINCOLN AVENUE NE, RENTON, WA, 98056, UNITED STATES",Administratively Dissolved,False,False,False
95,B&E INVESTMENTS LLC,"ABUNDANCE INVESTMENTS, LLC",604 048 713,12729,"1314 1/2 S 9TH AVE, YAKIMA, WA, 98902, UNITED STATES",Voluntarily Dissolved,False,False,False
96,B&E INVESTMENTS LLC,ACCT RECEIVABLES INVESTMENT LLC,604 625 032,1366331,"4754 16TH AVE NE APT 109, SEATTLE, WA, 98105-4288, UNITED STATES",Voluntarily Dissolved,False,False,False
97,B&E INVESTMENTS LLC,ADOBE INVESTMENT GROUP LIMITED PARTNERSHIP,602 041 746,458067,,Terminated,True,False,False
98,B&E INVESTMENTS LLC,"AFFORDABLE HOUSING INVESTMENT PARTNERS, LLC",603 349 389,19245,"1918 8TH AVE #3200, SEATTLE, WA, 98101, UNITED STATES",Voluntarily Dissolved,False,False,False
99,B&E INVESTMENTS LLC,AH BEAR PROPERTY INVESTMENTS LLC,602 522 104,488304,"1101 ISLAND BLVD, FOX ISLAND, WA, 98333-9624, UNITED STATES",Active,False,False,False
100,B&E INVESTMENTS LLC,"ALBERG FAMILY INVESTMENTS II, LLC",602 462 734,491255,"999 3RD AVE STE 3400, SEATTLE, WA, 98104-4046, UNITED STATES",Active,True,False,False
101,B&E INVESTMENTS LLC,"ALBERG FAMILY INVESTMENTS III, LLC",603 099 707,25662,"999 3RD AVE STE 3050, SEATTLE, WA, 98104-4057, UNITED STATES",Active,False,False,False
102,B&E INVESTMENTS LLC,ALBERG FAMILY INVESTMENTS LLC,601 998 302,533812,"999 3RD AVE STE 3400, SEATTLE, WA, 98104-4046, UNITED STATES",Active,True,False,False
103,B&E INVESTMENTS LLC,ALBERNI INVESTMENTS INC.,602 496 024,18923,"QUILCEDA BLVD #381, TULALIP, WA, 98271, UNITED STATES",Voluntarily Dissolved,False,False,False
104,B&E INVESTMENTS LLC,ALBERS INVESTMENTS LLC,603 590 686,1094661,"315 NE 166TH ST, SHORELINE, WA, 98155-4944, UNITED STATES",Active,False,False,False
105,B&E INVESTMENTS LLC,"ALBERS MILL INVESTMENTS, LLC",602 232 495,522351,,Administratively Dissolved,True,False,False
106,B&E INVESTMENTS LLC,ALDERBROOKE INVESTMENTS L.L.C.,603 031 098,491747,"10510 NORTHUP WAY STE 120, KIRKLAND, WA, 98033, UNITED STATES",Active,False,False,False
107,B&E INVESTMENTS LLC,"ALEC HEBER INVESTMENTS, LLC",603 539 360,25202,"10 W 15TH AVE, SPOKANE, WA, 99203-2102, UNITED STATES",Voluntarily Dissolved,False,False,False
108,B&E INVESTMENTS LLC,"ALI BERRY INVESTMENTS, LLC",602 870 620,22292,"13319 81ST AVE CT E, PUYALLUP, WA, 98373, UNITED STATES",Administratively Dissolved,False,False,False
109,B&E INVESTMENTS LLC,"ALKI BEACH INVESTMENTS, LLC",602 594 318,1076977,"2026 19TH AVE S, SEATTLE, WA, 98144-4408, UNITED STATES",Active,False,False,False
110,B&E INVESTMENTS LLC,"ALL BLUE PROPERTIES INVESTMENTS, INC.",604 331 940,1235433,"220 2ND AVE S, SEATTLE, WA, 98104-2222, UNITED STATES",Active,False,False,False
111,B&E INVESTMENTS LLC,ALL GAS NO BRAKES INVESTMENTS & HOLDINGS LLC,604 685 621,1411371,"3425 S 175TH ST, SEATAC, WA, 98188-3663, UNITED STATES",Delinquent,False,False,False
112,B&E INVESTMENTS LLC,"ALLIANCEBERNSTEIN INVESTMENTS, INC.",601 166 952,23291,"501 COMMERCE STREET, NASHVILLE, TN, 37203, UNITED STATES",Active,False,False,False
113,B&E INVESTMENTS LLC,"ALPHA CUBED INVESTMENTS, LLC",604 094 379,487530,"600 STEWART ST, SUITE 400, SEATTLE, WA, 98101-1217, UNITED STATES",Active,False,False,False
114,B&E INVESTMENTS LLC,ALPHABEE INVESTMENT MANAGEMENT LLC,604 939 764,1578104,"800 BELLEVUE WAY NE STE 600, BELLEVUE, WA, 98004-4289, UNITED STATES",Active,False,False,False
115,B&E INVESTMENTS LLC,"AMBER INVESTMENTS, L.L.C.",601 972 798,1095481,"1964 JUDD HILLSIDE RD, HONOLULU, HI, 96822-2004, UNITED STATES",Active,False,False,False
116,B&E INVESTMENTS LLC,"AMBER WAVES INVESTMENTS, LLC",603 156 384,26530,"2815 WILLOWS RD #311, SEAVIEW, WA, 98644, UNITED STATES",Voluntarily Dissolved,False,False,False
117,B&E INVESTMENTS LLC,AMBESSA INVESTMENTS LLC,604 653 124,1382444,"720 N 10TH ST, NUM 387 STE A, RENTON, WA, 98057-5683, UNITED STATES",Active,False,False,False
118,B&E INVESTMENTS LLC,AMBIENCE INVESTMENT GROUP LLC,603 312 311,26535,"7511 W ARROWHEAD AVE STE B, KENNEWICK, WA, 99336-1179, UNITED STATES",Active,False,False,False
119,B&E INVESTMENTS LLC,"AMBRAD-CHALELA INVESTMENTS, LLC",603 168 002,32323,"761 WILLIAMS BLVD, RICHLAND, WA, 99354-3221, UNITED STATES",Voluntarily Dissolved,False,False,False
120,B&E INVESTMENTS LLC,AMBROSE INVESTMENTS LIMITED PARTNERSHIP,601 977 924,37922,"1537 FAIRVIEW ST, BELLINGHAM, WA, 98229, UNITED STATES",Inactive,False,False,False
121,B&E INVESTMENTS LLC,AMEXCO VENTURE CAPITAL PACIFIC GROUP LLP,604 430 849,1284909,"15 S GRADY WAY STE LL18, RENTON, WA, 98057-3218, UNITED STATES",Active,True,True,True
122,B&E INVESTMENTS LLC,ANABELLEMASON INVESTMENTS LLC,605 162 735,1650376,"3020 ISSAQUAH PINE LAKE RD SE # 345, SAMMAMISH, WA, 98075-7253, UNITED STATES",Active,False,False,False
123,B&E INVESTMENTS LLC,ANGERSBACH REAL ESTATE INVESTMENTS LLC,603 522 006,34975,"15521 15TH AVE NE, SHORELINE, WA, 98155, UNITED STATES",Administratively Dissolved,False,False,False
124,B&E INVESTMENTS LLC,ANGRY BADGER INVESTMENTS LLC,603 592 050,37636,"18731 HIGH ROCK RD, MONROE, WA, 98272, UNITED STATES",Administratively Dissolved,False,False,False
125,B&E INVESTMENTS LLC,ANNABELLA INVESTMENTS LLC,603 552 292,541896,"11206 SE 268TH ST, KENT, WA, 98030, UNITED STATES",Administratively Dissolved,False,False,False
126,B&E INVESTMENTS LLC,ANTHONY & ABBEY MASCHMEDT INVESTMENT PROPERTIES LLC,602 767 319,542374,"5221 LAKE WASHINGTON BLVD S, SEATTLE, WA, 98118-2528, UNITED STATES",Active,False,False,False
127,B&E INVESTMENTS LLC,ARBOR PRIVATE INVESTMENT LLC,604 912 916,1557440,"333 EARLE OVINGTON BLVD STE 900, UNIONDALE, NY, 11553-3614, UNITED STATES",Active,False,False,False
128,B&E INVESTMENTS LLC,"ARBOR SQUARE II INVESTMENT ASSOCIATES, LLC",603 003 264,553106,"606 LILLY ROAD SE, OLYMPIA, WA, 98506, UNITED STATES",Administratively Dissolved,False,False,False
129,B&E INVESTMENTS LLC,"ARMO-MAYBEE INVESTMENT, LLC",602 785 345,40344,"6717 46TH AVE SW, SEATTLE, WA, 98136, UNITED STATES",Active,False,False,False
130,B&E INVESTMENTS LLC,ARSH NORTHPOINT BOISE INVESTMENT LLC,604 834 213,1507314,"607 SW GRADY WAY STE 210, RENTON, WA, 98057-2977, UNITED STATES",Active,False,False,False
131,B&E INVESTMENTS LLC,ASHDAN BLAKE INVESTMENTS L.L.C.,602 263 102,42095,,Terminated,True,False,False
132,B&E INVESTMENTS LLC,AUBREY P. SCHMIDT FAMILY INVESTMENTS LIMITED PARTNERSHIP,601 793 297,44332,,Inactive,True,False,False
133,B&E INVESTMENTS LLC,"AURORA BOREALIS INVESTMENTS, LLC",602 683 531,45906,"6021 12TH ST E #100, FIFE, WA, 98424, UNITED STATES",Administratively Dissolved,False,False,False
134,B&E INVESTMENTS LLC,"AUTOMOBILI ITALIANE REAL ESTATE INVESTMENT GROUP, LLC",601 971 345,45058,"1401 12TH AVE, SEATTLE, WA, 98122-3905, UNITED STATES",Active,False,False,False
135,B&E INVESTMENTS LLC,"AUTUMN BREE INVESTMENTS, LLC",604 424 955,1280597,"402-110 PRINCESS STREET, WINNIPEG, MB, R3B 1K7, CANADA",Active,False,False,False
136,B&E INVESTMENTS LLC,AYZENBERG INVESTMENT COMPANY L.L.C.,602 686 129,48338,"3035 70TH AVE SE, MERCER ISLAND, WA, 98040, UNITED STATES",Voluntarily Dissolved,False,False,False
137,B&E INVESTMENTS LLC,B & B CONSULTATION LLC,605 164 863,1652347,"737 SOLUNA RANCH WAY, KETTLE FALLS, WA, 99141-5069, UNITED STATES",Active,False,True,True
138,B&E INVESTMENTS LLC,"B & B ESPRESSO INVESTMENTS, LLC",605 026 142,1635569,"320 GARFIELD ST S # 44007, TACOMA, WA, 98448-0110, UNITED STATES",Active,False,False,False
139,B&E INVESTMENTS LLC,B & B PROPERTY INVESTMENT LLC,604 805 245,1488247,"1500 SE PARK CREST AVE, VANCOUVER, WA, 98683-8942, UNITED STATES",Active,False,False,False
140,B&E INVESTMENTS LLC,B & C UNITED INVESTMENTS LLC,604 502 408,1306987,"9621 185TH DR SE, SNOHOMISH, WA, 98290-6389, UNITED STATES",Active,False,False,False
141,B&E INVESTMENTS LLC,B & E INVESTMENT GROUP L.L.C.,602 887 985,544438,"169 NILE PL NE, RENTON, WA, 98059, UNITED STATES",Inactive,False,False,False
142,B&E INVESTMENTS LLC,"B & E INVESTMENT GROUP, LLC",603 414 667,35676,"409 SW 185TH ST, NORMANDY PARK, WA, 98166, UNITED STATES",Active,False,False,False
143,B&E INVESTMENTS LLC,"B & E INVESTMENTS, LLC",601 924 877,544439,"8451 SE 68TH ST STE 200, MERCER ISLAND, WA, 98040-5240, UNITED STATES",Active,False,False,False
144,B&E INVESTMENTS LLC,"B & G PROPERTY INVESTMENTS, LLC",603 482 899,563316,"8603 W 3RD AVE, KENNEWICK, WA, 99336-9403, UNITED STATES",Active,False,False,False
145,B&E INVESTMENTS LLC,B & H REAL ESTATE INVESTMENT LLC,604 897 827,1550849,"2568 SIEVERS WAY, FERNDALE, WA, 98248-9819, UNITED STATES",Active,False,False,False
146,B&E INVESTMENTS LLC,"B & L PROPERTY INVESTMENTS, LLC",602 226 410,47812,"223 E RIVERSIDE, SPOKANE, WA, 99220, UNITED STATES",Inactive,False,False,False
147,B&E INVESTMENTS LLC,B & L ZIMMERMAN INVESTMENTS LLC,603 162 825,559797,"19528 12TH AVE NE, SHORELINE, WA, 98155, UNITED STATES",Active,False,False,False
148,B&E INVESTMENTS LLC,"B & M REAL ESTATE INVESTMENTS, LLC",602 930 951,544662,"11100 NE 8TH ST STE 400, BELLEVUE, WA, 98004-4469, UNITED STATES",Active,False,False,False
149,B&E INVESTMENTS LLC,B & R ENTERPRISES AND INVESTMENTS LLC,603 088 208,567236,"31830 NE CHERRY VALLEY RD, DUVALL, WA, 98019-7723, UNITED STATES",Active,False,False,False
150,B&E INVESTMENTS LLC,"B ACQUISITION MAKENA INVESTMENT, LLC",601 981 475,50542,,Inactive,True,False,False
151,B&E INVESTMENTS LLC,"B BROTHERS INVESTMENTS, LLC",602 896 429,567366,"18654 NW BERNINA CT, ISSAQUAH, WA, 98027-7881, UNITED STATES",Voluntarily Dissolved,False,False,False
152,B&E INVESTMENTS LLC,"B C SAYWERS INVESTMENTS, INC.",603 072 343,561372,"6815 CLIFF AVE SW, LONGBRANCH, WA, 98351-9546, UNITED STATES",Active,False,False,False
153,B&E INVESTMENTS LLC,B COMMERCIAL INVESTMENTS L.L.C.,602 550 650,545115,"9006 189TH AVE CT E, BONNEY LAKE, WA, 98391, UNITED STATES",Inactive,False,False,False
154,B&E INVESTMENTS LLC,B KRAMER INVESTMENTS LLC,603 291 013,560847,"1442 SUNSET AVE, FERNDALE, WA, 98248-8914, UNITED STATES",Administratively Dissolved,False,False,False
155,B&E INVESTMENTS LLC,"B T PALMER INVESTMENTS, LLC",603 464 524,47998,"8122 BO CT SE, OLYMPIA, WA, 98501-9678, UNITED STATES",Delinquent,False,False,False
156,B&E INVESTMENTS LLC,"B&B REAL ESTATE INVESTMENTS, LLC",604 751 164,1459471,"1980 GREENBROOK BLVD, RICHLAND, WA, 99352, UNITED STATES",Active,False,False,False
157,B&E INVESTMENTS LLC,"B&B REAL ESTATE INVESTMENTS, LLC",604 469 327,1294463,,,True,True,True
158,B&E INVESTMENTS LLC,B&B REAL INVESTMENTS LLC,605 213 360,1658745,"2386 STATE HIGHWAY 508, ONALASKA, WA, 98570-9643, UNITED STATES",Active,False,False,False
159,B&E INVESTMENTS LLC,"B&B REALTY INVESTMENTS, LLC",603 434 673,567502,"2248 MERIDIAN BLVD STE H, MINDEN, NV, 89423-8620, UNITED STATES",Terminated,False,False,False
