,SearchTerm,BusinessName,UBINumber,BusinessId,Address,Status,address_match,ubi_match,id_match
634,B&E INVESTMENTS LLC,"BIRDNEST INVESTMENT GROUP, LLC",603 084 576,60920,"819 VIRGINIA ST., UNIT 1001, SEATTLE, WA, 98101, UNITED STATES",Terminated,False,False,False
635,B&E INVESTMENTS LLC,"BIRDSEYE INVESTMENTS, LLC",605 074 365,1639932,"356 LARMON RD, ETHEL, WA, 98542-9709, UNITED STATES",Active,False,False,False
636,B&E INVESTMENTS LLC,"BIRDWATCH ROCHE HARBOR INVESTMENTS, LLC",602 925 694,66761,"4118 MATTSON PL NE, BAINBRIDGE IS, WA, 98110-2227, UNITED STATES",Active,False,False,False
637,B&E INVESTMENTS LLC,"BIRINGER INVESTMENTS, L.P.",601 714 602,577076,"292 SHORE DR, CAMANO ISLAND, WA, 98282, UNITED STATES",Active,False,False,False
638,B&E INVESTMENTS LLC,"BIRKENWALD INVESTMENT CO., INC.",601 211 502,583110,,Administratively Dissolved,True,False,False
639,B&E INVESTMENTS LLC,"BIT FRANCHISE INVESTMENTS, LLC",603 565 346,61043,"710 SW 34TH ST, RENTON, WA, 98056, UNITED STATES",Delinquent,False,False,False
640,B&E INVESTMENTS LLC,BIT-TEL INVESTMENT LLC,602 968 431,577426,"3460 N MISSION RD W, BREMERTON, WA, 98312, UNITED STATES",Terminated,False,False,False
641,B&E INVESTMENTS LLC,BITTERROOT INVESTMENTS LLC,602 659 848,584098,"11709 CYRUS WAY, MUKILTEO, WA, 98275-5455, UNITED STATES",Active,False,False,False
642,B&E INVESTMENTS LLC,"BKE INVESTMENT GROUP,  LLC",604 713 051,1428594,"222 3RD AVE S, EDMONDS, WA, 98020-3502, UNITED STATES",Voluntarily Dissolved,False,False,False
643,B&E INVESTMENTS LLC,BKR REAL ESTATE INVESTMENTS LLC,604 249 144,1196119,"11802 MERIDIAN E, PUYALLUP, WA, 98373-3542, UNITED STATES",Administratively Dissolved,False,False,False
644,B&E INVESTMENTS LLC,"BLACK FOREST INVESTMENTS, LLC",604 839 431,1513275,"417 E PINE ST APT 210, SEATTLE, WA, 98122-2375, UNITED STATES",Administratively Dissolved,False,False,False
645,B&E INVESTMENTS LLC,BLACK GARDEN INVESTMENTS INC,603 546 598,588913,"16154 STONE AVE N, SHORELINE, WA, 98133, UNITED STATES",Administratively Dissolved,False,False,False
646,B&E INVESTMENTS LLC,BLACK IRON GATE INVESTMENT LLC,604 783 853,1477458,"16021 MANOR WAY UNIT B2, LYNNWOOD, WA, 98087-6385, UNITED STATES",Active,False,False,False
647,B&E INVESTMENTS LLC,"BLACK NUGGET INVESTMENTS, LLC",602 562 376,589690,"26625 SE OLD BLACK NUGGET RD, ISSAQUAH, WA, 98029, UNITED STATES",Administratively Dissolved,False,False,False
648,B&E INVESTMENTS LLC,"BLACK RIDGE INVESTMENTS, LLC",602 572 174,574697,"7812 FAIRWAY AVE SE, UNIT 1001, SNOQUALMIE, WA, 98065, UNITED STATES",Administratively Dissolved,False,False,False
649,B&E INVESTMENTS LLC,BLACK RIVER INVESTMENTS LLC,602 546 246,70251,"3213 W MAIN ST STE 203, ROCKERVILLE, SD, 57702, UNITED STATES",Terminated,False,False,False
650,B&E INVESTMENTS LLC,"BLACK SHEEP INVESTMENT, LLC",604 532 394,1325555,"1902 93RD AVE SW, OLYMPIA, WA, 98512-9155, UNITED STATES",Active,False,False,False
651,B&E INVESTMENTS LLC,"BLACK SHEEP INVESTMENTS, LLC",603 160 916,70363,"2740 SHERMAN AVE, PORT ORCHARD, WA, 98366, UNITED STATES",Administratively Dissolved,False,False,False
652,B&E INVESTMENTS LLC,BLACK WOLF BUSINESS & INVESTMENTS LLC,604 431 384,1273112,"608 HUNTER ST, RICHLAND, WA, 99352, UNITED STATES",Voluntarily Dissolved,False,False,False
653,B&E INVESTMENTS LLC,BLACKBEARD INVESTMENTS LLC,604 220 282,1181559,"2381 ROBERTSON DR, RICHLAND, WA, 99354-5307, UNITED STATES",Active,False,False,False
654,B&E INVESTMENTS LLC,"BLACKBERRY INVESTMENT GROUP, LLC",603 219 772,589847,"12702 E GUTHRIE DR, SPOKANE VLY, WA, 99216-2501, UNITED STATES",Administratively Dissolved,False,False,False
655,B&E INVESTMENTS LLC,BLACKBERRY PIE INVESTMENT LLC,604 922 812,1564309,"10915 157TH CT NE, REDMOND, WA, 98052-2662, UNITED STATES",Active,False,False,False
656,B&E INVESTMENTS LLC,"BLACKBURN REAL INVESTMENTS, LLC",604 198 770,1172649,"4742 Z ST, WASHOUGAL, WA, 98671-7484, UNITED STATES",Delinquent,False,False,False
657,B&E INVESTMENTS LLC,BLACKMOORE INVESTMENTS LLC,602 589 716,580430,"7415 CHAMBERS CREEK RD W, UNIVERSITY PLACE, WA, 98467, UNITED STATES",Voluntarily Dissolved,False,False,False
658,B&E INVESTMENTS LLC,"BLACKSTONE INVESTMENT PARTNERS, A WASHINGTON LIMITEDPARTNERSHIP",601 630 205,575544,,Inactive,True,False,False
659,B&E INVESTMENTS LLC,"BLACKSTONE INVESTMENT PROPERTIES I, L.L.C.",601 838 283,578191,,Administratively Dissolved,True,False,False
660,B&E INVESTMENTS LLC,"BLACKSTONE INVESTMENT PROPERTIES II, L.L.C.",601 838 282,575030,,Administratively Dissolved,True,False,False
661,B&E INVESTMENTS LLC,"BLACKSTONE INVESTMENT PROPERTIES III, LLC",601 880 444,590754,"35800 SE EVERGREEN HWY, WASHOUGAL, WA, 98671, UNITED STATES",Administratively Dissolved,True,False,False
662,B&E INVESTMENTS LLC,"BLACKSTONE INVESTMENT PROPERTIES IV, LLC",601 880 443,565336,"35800 SE EVERGREEN HWY, WASHOUGAL, WA, 98671, UNITED STATES",Active,True,False,False
663,B&E INVESTMENTS LLC,"BLACKSTONE INVESTMENT PROPERTIES V, LLC",601 880 442,575031,"35800 SE EVERGREEN HWY, WASHOUGAL, WA, 98671, UNITED STATES",Active,True,False,False
664,B&E INVESTMENTS LLC,"BLACKSTONE INVESTMENTS, L.L.C.",602 482 559,70601,"19220 NE UNION HILL RD, REDMOND, WA, 98053-9402, UNITED STATES",Voluntarily Dissolved,False,False,False
665,B&E INVESTMENTS LLC,BLACKWELL INVESTMENT GROUP LLC,602 394 851,575552,"11712 NW 26TH AVE, VANCOUVER, WA, 98685, UNITED STATES",Inactive,False,False,False
666,B&E INVESTMENTS LLC,BLADEN SCOTT INVESTMENTS LLC,604 879 083,1541443,"704 N UNIVERSITY RD, SPOKANE VLY, WA, 99206-5052, UNITED STATES",Delinquent,False,False,False
667,B&E INVESTMENTS LLC,"BLAINE FAMILY INVESTMENTS, L.L.C.",601 797 698,50557,"2802 70TH AVE E, FIFE, WA, 98424-3604, UNITED STATES",Active,False,False,False
668,B&E INVESTMENTS LLC,BLAINE INVESTMENTS LLC,604 262 219,1201285,"520 S 1ST ST, SUITE 201, MOUNT VERNON, WA, 98273-5926, UNITED STATES",Voluntarily Dissolved,False,False,False
669,B&E INVESTMENTS LLC,"BLAKE D. MILLS, JR. FAMILY INVESTMENTS LLC.",602 294 577,579011,"800 5TH AVE STE 3200, SEATTLE, WA, 98104-3176, UNITED STATES",Active,False,False,False
670,B&E INVESTMENTS LLC,"BLAKE INVESTMENTS, LLC",602 367 799,580615,"PO BOX 9996, SEATTLE, WA, 98109, UNITED STATES",Administratively Dissolved,False,False,False
671,B&E INVESTMENTS LLC,BLANCO RESIDENTIAL INVESTMENT CORPORATION,603 599 660,66981,"3733 221ST PL SE, SAMMAMISH, WA, 98075, UNITED STATES",Administratively Dissolved,False,False,False
672,B&E INVESTMENTS LLC,BLATTNER INVESTMENTS L.L.C.,601 868 224,1100180,"601 UNION ST STE 2930, SEATTLE, WA, 98101-2327, UNITED STATES",Active,False,False,False
673,B&E INVESTMENTS LLC,BLATTNER INVESTMENTS ORCHARD PARTNERS LLC,603 329 133,579205,,Administratively Dissolved,True,False,False
674,B&E INVESTMENTS LLC,"BLAU REAL ESTATE INVESTMENTS, LLC",603 542 645,591214,"4701 SW ADMIRAL WAY #251, SEATTLE, WA, 98116, UNITED STATES",Active,False,False,False
675,B&E INVESTMENTS LLC,BLE INVESTMENTS LLC,602 676 277,565671,"25200 NE 188TH CT, BATTLE GROUND, WA, 98604-5818, UNITED STATES",Active,False,False,False
676,B&E INVESTMENTS LLC,BLESSED COAST INVESTMENTS LLC,604 760 977,1467133,"522 W RIVERSIDE AVE STE N, SPOKANE, WA, 99201-0580, UNITED STATES",Administratively Dissolved,True,False,False
677,B&E INVESTMENTS LLC,BLESSED INVESTMENTS LLC,604 200 116,1169686,"10011 BRIDGEPORT WAY SW STE 1500 # 249, LAKEWOOD, WA, 98499-2332, UNITED STATES",Administratively Dissolved,False,False,False
678,B&E INVESTMENTS LLC,"BLESSING INVESTMENT, LLC",604 466 111,1291859,"3312 102ND AVE NE, BELLEVUE, WA, 98004-1921, UNITED STATES",Administratively Dissolved,False,False,False
679,B&E INVESTMENTS LLC,"BLETKO INVESTMENTS, LLC",604 480 482,1295304,"19915 SE ASCENSION LOOP, CAMAS, WA, 98607, UNITED STATES",Active,False,False,False
680,B&E INVESTMENTS LLC,BLIND SQUIRREL INVESTMENTS LLC,604 120 321,65253,"14985 GIBRALTER RD, ANACORTES, WA, 98221-8621, UNITED STATES",Active,False,False,False
681,B&E INVESTMENTS LLC,BLISS DEVICES INVESTMENTS LLC,603 380 809,69508,"1001 4TH AVE # 4500, SEATTLE, WA, 98154, UNITED STATES",Administratively Dissolved,False,False,False
682,B&E INVESTMENTS LLC,BLIVEN INVESTMENTS LLC,603 021 348,565967,"131 S 198THB PL, DES MOINES, WA, 98148, UNITED STATES",Inactive,False,False,False
683,B&E INVESTMENTS LLC,BLM UNIVERSAL INVESTMENTS LLC.,603 036 712,587553,"1818 W. FRANCIS AVE #266, SPOKANE, WA, 99205, UNITED STATES",Voluntarily Dissolved,False,False,False
684,B&E INVESTMENTS LLC,"BLOOMFIELD INVESTMENTS, L.L.C.",602 926 571,67750,"19221 SR 194, PULLMAN, WA, 99163, UNITED STATES",Active,False,False,False
685,B&E INVESTMENTS LLC,"BLOWERS INVESTMENTS, LLC",604 524 130,1313627,"4474 LONG LAKE RD SE, PORT ORCHARD, WA, 98366-8655, UNITED STATES",Active,False,False,False
686,B&E INVESTMENTS LLC,"BLS PROPERTY INVESTMENTS, LLC",604 733 400,1439039,"633 S MACARTHUR ST, TACOMA, WA, 98465-1819, UNITED STATES",Administratively Dissolved,False,False,False
687,B&E INVESTMENTS LLC,"BLUE ATLAS INVESTMENTS, LLC",604 151 270,592261,"1911 SW CAMPUS DR # 663, FEDERAL WAY, WA, 98023-6473, UNITED STATES",Active,False,False,False
688,B&E INVESTMENTS LLC,BLUE BIRD RIDGE INVESTMENT LLC,604 544 406,1324363,"4200 SE COLUMBIA WAY, SUITE F, VANCOUVER, WA, 98661-5572, UNITED STATES",Active,False,False,False
689,B&E INVESTMENTS LLC,BLUE BLUE OCEAN INVESTMENT LLC,604 224 618,1183278,"2830 109TH AVE SE, BELLEVUE, WA, 98004-7537, UNITED STATES",Active,False,False,False
690,B&E INVESTMENTS LLC,"BLUE BOAR INVESTMENTS, LLC",603 025 630,51382,"842 SOUTH STEELE STREET, TACOMA, WA, 98405, UNITED STATES",Active,False,False,False
691,B&E INVESTMENTS LLC,"BLUE CAMO INVESTMENTS, LLC",602 987 222,510463,"6501 E GREENWAY PKWY STE 103-486, SCOTTSDALE, AZ, 85254-2025, UNITED STATES",Active,False,False,False
692,B&E INVESTMENTS LLC,"BLUE CHAIR INVESTMENTS, INC.",604 689 799,1417719,"4316 68TH AVENUE CT W, UNIVERSITY PL, WA, 98466-4909, UNITED STATES",Administratively Dissolved,False,False,False
693,B&E INVESTMENTS LLC,BLUE CHIP INVESTMENTS LLC,603 361 881,68264,"23420 SE 448TH, ENUMCLAW, WA, 98022, UNITED STATES",Administratively Dissolved,False,False,False
694,B&E INVESTMENTS LLC,BLUE COLLAR INVESTMENTS LLC,602 560 471,588080,"4463 W JARSTAD DR, BREMERTON, WA, 98312, UNITED STATES",Administratively Dissolved,False,False,False
695,B&E INVESTMENTS LLC,"BLUE CREEK INVESTMENTS, LLC",604 666 747,1401047,"282 SW 13TH ST, CHEHALIS, WA, 98532-3607, UNITED STATES",Active,False,False,False
696,B&E INVESTMENTS LLC,"BLUE DIAMOND INVESTMENTS, LLC",603 196 426,51503,"18409 E 4TH AVE, SPOKANE VLY, WA, 99016-7710, UNITED STATES",Active,False,False,False
697,B&E INVESTMENTS LLC,"BLUE DIAMOND LAND & HOME INVESTMENTS, LLC",604 013 109,581467,"9353 CENTRAL VALLEY RD NE, BREMERTON, WA, 98311, UNITED STATES",Administratively Dissolved,False,False,False
698,B&E INVESTMENTS LLC,BLUE DOG INVESTMENTS LLC,602 530 386,69958,"6301 NE WINDERMERE RD, SEATTLE, WA, 98105-2053, UNITED STATES",Administratively Dissolved,False,False,False
699,B&E INVESTMENTS LLC,"BLUE DOLPHIN INVESTMENT, LLC",604 592 059,1349889,"400 NW GILMAN BLVD, UNIT 2675, ISSAQUAH, WA, 98027-0122, UNITED STATES",Active,False,False,False
700,B&E INVESTMENTS LLC,BLUE DOOR HOME INVESTMENTS AND DESIGN PLLC,604 327 833,1228894,"16071 LORDS LAKE AVE SE, MONROE, WA, 98272-2862, UNITED STATES",Administratively Dissolved,False,False,False
701,B&E INVESTMENTS LLC,"BLUE DOT INVESTMENTS, LLC",603 433 601,1100314,"1149 NW DARLING RD, BREMERTON, WA, 98311-9083, UNITED STATES",Active,False,False,False
702,B&E INVESTMENTS LLC,BLUE DREAM INVESTMENTS LLC,603 339 899,60895,"1102 W NOB HILL BLVD, YAKIMA, WA, 98902, UNITED STATES",Administratively Dissolved,False,False,False
703,B&E INVESTMENTS LLC,BLUE FISH INVESTMENTS LLC,604 978 901,1600345,"11 DIAMOND S RANCH, BELLEVUE, WA, 98004-2819, UNITED STATES",Active,False,False,False
704,B&E INVESTMENTS LLC,BLUE FLOWER INVESTMENTS LLC,603 533 292,60902,"1890 MAPLE AVE, APT 407E, EVANSTON, IL, 60201, UNITED STATES",Administratively Dissolved,False,False,False
705,B&E INVESTMENTS LLC,BLUE FOX FREEDOM INVESTMENT LLC,603 231 932,588098,"500 W ROY ST #408, SEATTLE, WA, 98119, UNITED STATES",Administratively Dissolved,False,False,False
706,B&E INVESTMENTS LLC,BLUE FROG INVESTMENTS LLC,604 054 321,1100326,"660 NW GILMAN BLVD # C4, ISSAQUAH, WA, 98027, UNITED STATES",Administratively Dissolved,False,False,False
707,B&E INVESTMENTS LLC,BLUE FUSION INVESTMENTS LLC,604 477 388,1302156,"2120 W WOODIN AVE, CHELAN, WA, 98816, UNITED STATES",Active,False,False,False
708,B&E INVESTMENTS LLC,"BLUE GROUSE INVESTMENTS, INC.",602 839 069,577396,"4630 200TH ST SW STE G-2, LYNNWOOD, WA, 98036, UNITED STATES",Inactive,False,False,False
709,B&E INVESTMENTS LLC,BLUE HEAVEN INVESTMENTS LLC,604 724 473,1441561,"MC-CSC1, 300 DESCHUTES WAY SW STE 208, TUMWATER, WA, 98501, UNITED STATES",Active,False,False,False
710,B&E INVESTMENTS LLC,BLUE HEELER INVESTMENTS. LLC,604 164 539,60949,"1224 S SPRUCE ST, BURLINGTON, WA, 98233, UNITED STATES",Active,False,False,False
711,B&E INVESTMENTS LLC,BLUE HERON CAPITAL INVESTMENTS LLC,602 878 129,593008,"4128 W AMES LAKE DR NE, REDMOND, WA, 98053-9100, UNITED STATES",Administratively Dissolved,False,False,False
712,B&E INVESTMENTS LLC,BLUE HERON INVESTMENTS LLC,603 563 302,1100344,"4800 G LOOP RD, BOW, WA, 98232-9343, UNITED STATES",Active,False,False,False
713,B&E INVESTMENTS LLC,BLUE HERON REAL ESTATE INVESTMENTS LLC,604 036 609,70299,"1536 BISHOP ROAD, CHEHALIS, WA, 98532, UNITED STATES",Administratively Dissolved,False,False,False
714,B&E INVESTMENTS LLC,BLUE HOUSE INVESTMENT HOLDINGS (US) INC.,604 993 807,1610989,"705 WEST 23RD AVE, VANCOUVER, BC, V5Z 2A7, CANADA",Active,False,False,False
715,B&E INVESTMENTS LLC,"BLUE INFINITY REAL ESTATE INVESTMENTS, LLC",604 328 786,1232247,"3225 MCLEOD DR, SUITE 100, LAS VEGAS, NV, 89121-2257, UNITED STATES",Administratively Dissolved,False,False,False
716,B&E INVESTMENTS LLC,"BLUE INVESTMENT GROUP, LLC",602 778 146,70415,"7708 44TH AVE NE, SEATTLE, WA, 98115, UNITED STATES",Inactive,False,False,False
717,B&E INVESTMENTS LLC,"BLUE INVESTMENT GROUP, LP",604 150 147,51690,"10900 NE 4TH ST STE 1430, BELLEVUE, WA, 98004, UNITED STATES",Administratively Dissolved,False,False,False
718,B&E INVESTMENTS LLC,"BLUE INVESTMENTS, LLC",604 316 127,1223408,"7089 171ST AVE SE, BELLEVUE, WA, 98006, UNITED STATES",Administratively Dissolved,False,False,False
719,B&E INVESTMENTS LLC,BLUE LAKE REAL ESTATE INVESTMENTS LLC,603 418 599,87082,"8717 SE 44TH PL, MERCER ISLAND, WA, 98040, UNITED STATES",Administratively Dissolved,False,False,False
720,B&E INVESTMENTS LLC,BLUE LIGHT INVESTMENTS LLC,602 762 294,61001,"601 VALLEY AVE NE STE A, PUYALLUP, WA, 98372, UNITED STATES",Active,False,False,False
721,B&E INVESTMENTS LLC,BLUE LINE INVESTMENTS LLC,604 761 538,1460256,"35434 26TH AVE S, FEDERAL WAY, WA, 98003, UNITED STATES",Administratively Dissolved,False,False,False
722,B&E INVESTMENTS LLC,"BLUE MERIDIAN INVESTMENTS, LLC",602 759 452,72256,"19737 RAINIER VIEW RD SE, MONROE, WA, 98272-8770, UNITED STATES",Administratively Dissolved,False,False,False
723,B&E INVESTMENTS LLC,BLUE MOON INVESTMENTS LLC,604 463 586,1286878,"4307 LIBBY RD NE, SUITE E, OLYMPIA, WA, 98506-2522, UNITED STATES",Active,False,False,False
724,B&E INVESTMENTS LLC,"BLUE MOOSE INVESTMENTS, LLC",604 378 925,1255699,"22705 93RD PL W, EDMONDS, WA, 98020-4517, UNITED STATES",Administratively Dissolved,False,False,False
725,B&E INVESTMENTS LLC,"BLUE MOUNTAIN INVESTMENTS, LLC",602 608 800,68584,"1969 VALLEY HIGHWAY, ACME, WA, 98220-0000, UNITED STATES",Active,False,False,False
726,B&E INVESTMENTS LLC,"BLUE MOUNTAIN PROPERTY INVESTMENTS, L.L.C.",603 586 156,68589,"1003 HAVEN HEIGHTS DR, SEQUIM, WA, 98382-7104, UNITED STATES",Administratively Dissolved,False,False,False
727,B&E INVESTMENTS LLC,BLUE OCEAN INVESTMENT GROUP LLC,604 569 880,1341037,"11567 174TH AVE NE, REDMOND, WA, 98052-1642, UNITED STATES",Voluntarily Dissolved,False,False,False
728,B&E INVESTMENTS LLC,"BLUE PACIFIC INVESTMENTS, INC.",602 607 089,577850,"27120 112TH ST E, BUCKLEY, WA, 98321, UNITED STATES",Inactive,False,False,False
729,B&E INVESTMENTS LLC,BLUE PANSY INVESTMENT LLC,604 545 688,1393349,"14040 NE 8TH ST STE 313, BELLEVUE, WA, 98007-4122, UNITED STATES",Active,False,False,False
730,B&E INVESTMENTS LLC,"BLUE PLATYPUS INVESTMENTS, LLC",604 164 166,51846,"7560 123RD AVE NE, KIRKLAND, WA, 98033-8226, UNITED STATES",Administratively Dissolved,False,False,False
731,B&E INVESTMENTS LLC,BLUE POINT CAPITAL INVESTMENT LLC,604 125 993,567109,"561 KELLY WAY, PALO ALTO, CA, 94306-4325, UNITED STATES",Terminated,False,False,False
732,B&E INVESTMENTS LLC,BLUE RAINDROP INVESTMENT LLC,604 839 104,1510428,,,True,True,True
733,B&E INVESTMENTS LLC,BLUE RAPIDS INVESTMENT TRUST NUMBER III LIMITED PARTNERSHIP,601 817 115,583000,,Inactive,True,False,False
734,B&E INVESTMENTS LLC,BLUE RIDGE INVESTMENTS LLC,605 021 620,1629163,"5211 213TH PL SW UNIT 0, MOUNTLAKE TER, WA, 98043-6109, UNITED STATES",Active,False,False,False
735,B&E INVESTMENTS LLC,"BLUE RIDGE PROPERTY INVESTMENTS, LLC",602 947 094,68836,"5711 NE 77TH ST, SEATTLE, WA, 98115, UNITED STATES",Active,False,False,False
736,B&E INVESTMENTS LLC,BLUE RISE GLOBAL INVESTMENTS LLC,603 345 010,68838,"8960 CLAIRTON CT, LAS VEGAS, NV, 89117, UNITED STATES",Terminated,False,False,False
737,B&E INVESTMENTS LLC,BLUE RIVER ESTATE INVESTMENTS LLC,604 401 475,1257464,"26 HADLEY RD, BREWSTER, WA, 98812-9678, UNITED STATES",Voluntarily Dissolved,False,False,False
738,B&E INVESTMENTS LLC,BLUE SALVIA INVESTMENT CLUB LP,604 645 739,1379854,"6331 SOL DUC DR NE, BREMERTON, WA, 98311-3187, UNITED STATES",Administratively Dissolved,False,False,False
739,B&E INVESTMENTS LLC,"BLUE SAND INVESTMENTS, LLC",602 757 969,567250,"596 INDUSTRY DR STE 260, TUKWILA, WA, 98188, UNITED STATES",Administratively Dissolved,False,False,False
740,B&E INVESTMENTS LLC,"BLUE SEAT INVESTMENTS, LLC",603 579 441,70866,"4114 215TH ST SE, BOTHELL, WA, 98021, UNITED STATES",Administratively Dissolved,False,False,False
741,B&E INVESTMENTS LLC,"BLUE SEAT INVESTMENTS, LLC",604 490 430,1300238,"4114 215TH ST SE, BOTHELL, WA, 98021-7986, UNITED STATES",Voluntarily Dissolved,False,False,False
742,B&E INVESTMENTS LLC,"BLUE SKY INVESTMENTS NW, LLC",603 236 620,588984,"436 BROADMOOR STREET, RICHLAND, WA, 99352, UNITED STATES",Administratively Dissolved,False,False,False
743,B&E INVESTMENTS LLC,"BLUE SKY INVESTMENTS, INC.",601 906 144,580453,"709 RAINIER AVE E, ZILLAH, WA, 98953, UNITED STATES",Active,False,False,False
744,B&E INVESTMENTS LLC,"BLUE SKY REAL ESTATE INVESTMENTS, LLC",603 038 162,567570,"26403 8TH AVE. S., DES MOINES, WA, 98198, UNITED STATES",Active,False,False,False
745,B&E INVESTMENTS LLC,BLUE SLOUGH INVESTMENTS LLC,604 284 217,1203055,"3558 CHINOOK ST, LONGVIEW, WA, 98632-5456, UNITED STATES",Active,False,False,False
746,B&E INVESTMENTS LLC,"BLUE SPRUCE INVESTMENTS, LLC",604 582 209,1340885,"327 PALM DR, RICHLAND, WA, 99352-7696, UNITED STATES",Active,False,False,False
747,B&E INVESTMENTS LLC,"BLUE STREAK INVESTMENTS, LLC",602 565 493,567581,"5011 CRYSTAL SPRINGS DR NE, BAINBRIDGE ISLAND, WA, 98110-2001, UNITED STATES",Active,False,False,False
748,B&E INVESTMENTS LLC,"BLUE TULIP INVESTMENTS, LLC",605 082 410,1640266,"18529 N ATLANTIC RD, COLBERT, WA, 99005-9276, UNITED STATES",Active,False,False,False
749,B&E INVESTMENTS LLC,"BLUE WATER INTERNATIONAL INVESTMENTS, INC.",602 268 213,583285,,Administratively Dissolved,True,False,False
750,B&E INVESTMENTS LLC,"BLUE WATER INVESTMENT FUND II, L.P.",603 201 692,577949,"2115 N 30TH ST #102, TACOMA, WA, 98403, UNITED STATES",Administratively Dissolved,False,False,False
751,B&E INVESTMENTS LLC,"BLUE WATER INVESTMENTS, INC",602 409 995,73386,"21 VASHON KY, BELLEVUE, WA, 98006-1029, UNITED STATES",Active,False,False,False
752,B&E INVESTMENTS LLC,"BLUE WATER PROPERTY INVESTMENTS, LLC",602 875 331,580949,"16847 234TH WAY SE, MAPLE VALLEY, WA, 98038, UNITED STATES",Inactive,False,False,False
753,B&E INVESTMENTS LLC,BLUE WHALE INVESTMENTS LLC,604 986 777,1610303,"2055 79TH AVE NE, MEDINA, WA, 98039-2320, UNITED STATES",Active,False,False,False
754,B&E INVESTMENTS LLC,"BLUE WHALE INVESTMENTS, LLC",602 772 314,88684,"4503 NE 141ST STREET, VANCOUVER, WA, 98682, UNITED STATES",Terminated,False,False,False
755,B&E INVESTMENTS LLC,BLUE WING INVESTMENT LLC,602 467 134,67204,"6820 20TH ST E STE A, FIFE, WA, 98424-2216, UNITED STATES",Active,False,False,False
756,B&E INVESTMENTS LLC,"BLUE WOLF INVESTMENTS, LLC",604 167 701,580955,"510 STEVENS AVE SW APT Q305, RENTON, WA, 98057, UNITED STATES",Administratively Dissolved,False,False,False
757,B&E INVESTMENTS LLC,"BLUE-22 INVESTMENTS, INC.",603 059 436,62545,,Administratively Dissolved,True,False,False
758,B&E INVESTMENTS LLC,BLUEBERRY INVESTMENT LLC,604 634 486,1373854,"3225 NW 61ST ST, SEATTLE, WA, 98107-2612, UNITED STATES",Active,False,False,False
759,B&E INVESTMENTS LLC,BLUEBERRY PIE INVESTMENT LLC,604 920 916,1564307,"12217 83RD PL NE, KIRKLAND, WA, 98034-5819, UNITED STATES",Active,False,False,False
760,B&E INVESTMENTS LLC,BLUEBIRD INVESTMENTS L.L.C.,602 292 296,589030,"10605 S CEDAR RD, SPOKANE, WA, 99224-9621, UNITED STATES",Active,False,False,False
761,B&E INVESTMENTS LLC,"BLUEBIRD INVESTMENTS, INC.",601 900 366,52115,,Terminated,True,False,False
762,B&E INVESTMENTS LLC,BLUEBIRD MANAGEMENT AND INVESTMENTS LLC,604 792 221,1480988,"5405 E VILLAGE RD # 8511, LONG BEACH, CA, 90808-7022, UNITED STATES",Withdrawn,False,False,False
763,B&E INVESTMENTS LLC,"BLUEBRIDGE INVESTMENTS, LLC",603 318 983,69158,"450 SE 10TH ST, NORTH BEND, WA, 98045, UNITED STATES",Administratively Dissolved,False,False,False
764,B&E INVESTMENTS LLC,BLUECHIP INVESTMENT GROUP INC,603 486 466,578052,,Administratively Dissolved,True,False,False
765,B&E INVESTMENTS LLC,BLUEFOOT INVESTMENTS L.P.,602 884 812,69274,"4020 E MADISON ST #321, SEATTLE, WA, 98112, UNITED STATES",Withdrawn,False,False,False
766,B&E INVESTMENTS LLC,"BLUEFOOT QUALIFIED INVESTMENTS, L.P.",602 884 804,67214,,Terminated,True,False,False
767,B&E INVESTMENTS LLC,"BLUEFRAN INVESTMENTS, LLC",604 398 750,1263299,"1810 208TH PL SE, SAMMAMISH, WA, 98075-9226, UNITED STATES",Active,False,False,False
768,B&E INVESTMENTS LLC,BLUEGOLD INVESTMENTS LLC,604 170 617,88716,"4309 7TH AVE NE APT B6, SEATTLE, WA, 98105-4969, UNITED STATES",Administratively Dissolved,False,False,False
769,B&E INVESTMENTS LLC,"BLUEHAWK INVESTMENT, LLC",603 567 945,594128,"10501 NE 38TH PL, KIRKLAND, WA, 98033-7900, UNITED STATES",Voluntarily Dissolved,False,False,False
770,B&E INVESTMENTS LLC,BLUEHILL INVESTMENT LLC,604 199 422,1168671,,,True,True,True
771,B&E INVESTMENTS LLC,BLUEHILL INVESTMENT LLC,604 199 422,1168671,"2805 43RD AVE W, SEATTLE, WA, 98199-2423, UNITED STATES",Delinquent,False,True,True
772,B&E INVESTMENTS LLC,BLUELADDER INVESTMENTS LLC,604 366 985,1251204,"614 E UNION ST, APT 304, SEATTLE, WA, 98122-3708, UNITED STATES",Voluntarily Dissolved,False,False,False
773,B&E INVESTMENTS LLC,BLUEROCK INVESTMENT LLC,603 266 845,580527,"10216 NE 13TH AVE, VANCOUVER, WA, 98686, UNITED STATES",Administratively Dissolved,False,False,False
774,B&E INVESTMENTS LLC,BLUEROCK REAL ESTATE INVESTMENTS LLC,604 916 212,1558497,"111B N QUAIL TRAIL LN, COUPEVILLE, WA, 98239-3609, UNITED STATES",Active,False,False,False
775,B&E INVESTMENTS LLC,"BLUESKIES INVESTMENTS, LLC",602 545 959,581037,,Administratively Dissolved,True,False,False
776,B&E INVESTMENTS LLC,"BLUESTARINVESTMENT, LLC",604 344 597,1241078,"15827 GARDEN ACRES LN SE, YELM, WA, 98597-9127, UNITED STATES",Administratively Dissolved,False,False,False
777,B&E INVESTMENTS LLC,BLUESTONE INVESTMENTS LP,604 011 760,73497,"1615 108TH AVE SE, BELLEVUE, WA, 98004-6919, UNITED STATES",Active,False,False,False
778,B&E INVESTMENTS LLC,BLUESTONE REALTY INVESTMENTS INC.,602 952 161,581043,"PO BOX 14038, MILL CREEK, WA, 98082, UNITED STATES",Inactive,False,False,False
779,B&E INVESTMENTS LLC,BLUESUN USA INVESTMENT LLC,604 550 931,1329107,"10 148TH AVE NE STE 202, BELLEVUE, WA, 98007-4947, UNITED STATES",Active,False,False,False
780,B&E INVESTMENTS LLC,"BLUEWATER INVESTMENT GROUP, LLC",602 761 027,568149,"6303 147TH CT NE, REDMOND, WA, 98052-4684, UNITED STATES",Active,False,False,False
781,B&E INVESTMENTS LLC,BLUEWAVE INVESTMENTS LLC,604 795 273,1485508,"100 N HOWARD ST STE R, SPOKANE, WA, 99201-0508, UNITED STATES",Active,True,False,False
782,B&E INVESTMENTS LLC,BLUME INVESTMENT CO.,178 077 308,1100491,"5506 NE PENRITH RD, SEATTLE, WA, 98105-2845, UNITED STATES",Active,False,False,False
783,B&E INVESTMENTS LLC,"BLY PROPERTY INVESTMENTS, LLC",604 060 223,589678,"7306 56TH AVE NE, SEATTLE, WA, 98115-6225, UNITED STATES",Active,False,False,False
784,B&E INVESTMENTS LLC,"BNB PROPERTY INVESTMENTS, LLC",603 338 300,594211,"65 WORDEN LN, TOUCHET, WA, 99360-9529, UNITED STATES",Active,False,False,False
785,B&E INVESTMENTS LLC,"BNE INVESTMENTS, LLC",604 970 103,1595317,"10824 53RD AVE W, MUKILTEO, WA, 98275-4411, UNITED STATES",Active,False,False,False
786,B&E INVESTMENTS LLC,"BNEXGEN INVESTMENT, INC.",604 229 437,1187788,"571 ROSARIO AVE NE, RENTON, WA, 98059-4553, UNITED STATES",Active,False,False,False
787,B&E INVESTMENTS LLC,BNK REAL ESTATE INVESTMENT LLC,604 024 016,583936,"17020 NE 40TH CT, REDMOND, WA, 98052-5491, UNITED STATES",Administratively Dissolved,False,False,False
788,B&E INVESTMENTS LLC,"BNKE INVESTMENT GROUP, LLC",603 413 093,67607,"33702 42ND CT S, FEDERAL WAY, WA, 98001, UNITED STATES",Administratively Dissolved,False,False,False
789,B&E INVESTMENTS LLC,"BO-SEUNG INVESTMENT, INC.",602 376 444,89387,"619 NW 162ND ST, SEATTLE, WA, 98177, UNITED STATES",Administratively Dissolved,False,False,False
