,SearchTerm,BusinessName,UBINumber,BusinessId,Address,Status,address_match,ubi_match,id_match
1109,B&E INVESTMENTS LLC,CAMPBELL INVESTMENT COMPANY,578 084 211,600103,"1405 E JOHN ST #2, ATT:  WALKER, SEATTLE, WA, 98112, UNITED STATES",Delinquent,False,False,False
1110,B&E INVESTMENTS LLC,"CAMPBELL LAND INVESTMENTS, LLC",604 352 014,1240767,"154A RODEO TRL, OKANOGAN, WA, 98840-8229, UNITED STATES",Active,False,False,False
1111,B&E INVESTMENTS LLC,"CAMPBELL-LUFKIN INVESTMENTS, LLC",603 360 795,595348,"9509 NE 30TH ST, CLYDE HILL, WA, 98004-1741, UNITED STATES",Active,False,False,False
1112,B&E INVESTMENTS LLC,"CANTERBURY ESTATES INVESTMENTS, LLC",602 605 061,84351,"219 S 156 STREET, BURIEN, WA, 98148, UNITED STATES",Administratively Dissolved,False,False,False
1113,B&E INVESTMENTS LLC,CAPTAIN WHIDBEY INVESTMENT PARTNERS LLC,604 239 014,1191389,"2020 SW 4TH AVE, SUITE 600, PORTLAND, OR, 97201, UNITED STATES",Active,False,False,False
1114,B&E INVESTMENTS LLC,CARBON CYCLE INVESTMENTS LLC,603 062 335,68683,"1727 E SPRINGFIELD AVE, SPOKANE, WA, 99202, UNITED STATES",Administratively Dissolved,False,False,False
1115,B&E INVESTMENTS LLC,CARBON RIDGE INVESTMENTS LLC,602 995 771,602326,"1745 FARRELLY ST, ENUMCLAW, WA, 98022, UNITED STATES",Voluntarily Dissolved,False,False,False
1116,B&E INVESTMENTS LLC,"CARIBOU CREEK INVESTMENTS, LLC",602 715 977,86755,"6711 WEST MERCER WAY, MERCER ISLAND, WA, 98040, UNITED STATES",Active,False,False,False
1117,B&E INVESTMENTS LLC,CARIBOU RIVER INVESTMENTS LLC,603 547 152,619780,"315 GARDEN OF EDEN RD, SEDRO WOOLLEY, WA, 98284, UNITED STATES",Active,False,False,False
1118,B&E INVESTMENTS LLC,CARTER BROTHERS INVESTMENTS LLC,604 269 259,1209974,"47105 290TH AVE SE, ENUMCLAW, WA, 98022-7336, UNITED STATES",Administratively Dissolved,False,False,False
1119,B&E INVESTMENTS LLC,CASCADE FRESH PRODUCE & FOOD PRODUCTS LLC,604 308 308,1221761,"15 S. GRADY WAY, SUITE  LL 18, RENTON, WA, 98057, UNITED STATES",Active,False,True,True
1120,B&E INVESTMENTS LLC,"CASTLE BUTTE INVESTMENTS, LLC",604 922 558,1565758,"404 S 51ST AVE, YAKIMA, WA, 98908-3419, UNITED STATES",Active,False,False,False
1121,B&E INVESTMENTS LLC,CBE INVESTMENTS LLC,604 551 181,1392543,"3211 W LAKESIDE DR, MOSES LAKE, WA, 98837-4519, UNITED STATES",Active,False,False,False
1122,B&E INVESTMENTS LLC,CBG RE INVESTMENTS I LLC,603 200 367,90255,"335 PARKPLACE CTR #G-109, KIRKLAND, WA, 98033, UNITED STATES",Administratively Dissolved,False,False,False
1123,B&E INVESTMENTS LLC,"CBO FUTURE INVESTMENTS, LLC",603 201 362,100222,,Administratively Dissolved,True,False,False
1124,B&E INVESTMENTS LLC,"CBP SUNSET INVESTMENTS, LLC",602 790 581,90351,"6911 CHUCKANUT DR, BOW, WA, 98232-9281, UNITED STATES",Active,False,False,False
1125,B&E INVESTMENTS LLC,"CBRE INVESTMENT MANAGEMENT, LLC",603 170 235,97487,"200 PARK AVE, SUITE 2001, NEW YORK, NY, 10166, UNITED STATES",Active,False,False,False
1126,B&E INVESTMENTS LLC,CD BEELS INVESTMENTS LLC.,603 525 260,100968,"4430 ROXANNA LOOP SE, LACEY, WA, 98503, UNITED STATES",Voluntarily Dissolved,False,False,False
1127,B&E INVESTMENTS LLC,"CEDAR BREEZE INVESTMENTS, LLC",604 462 613,1283947,"3807 SUTTON PL, ANACORTES, WA, 98221-1167, UNITED STATES",Active,False,False,False
1128,B&E INVESTMENTS LLC,"CEEBEE INVESTMENTS, LLC",602 379 654,101797,"502 225TH PLACE SE, BOTHELL, WA, 98021, UNITED STATES",Administratively Dissolved,False,False,False
1129,B&E INVESTMENTS LLC,"CHAMBERS INVESTMENTS, LLC",602 865 416,98466,"14751 N KELSEY ST #105 #341, MONROE, WA, 98272, UNITED STATES",Active,False,False,False
1130,B&E INVESTMENTS LLC,"CHANDLER & CAMPBELLE INVESTMENT GROUP, LLC.",604 700 335,1420167,"310 VIZCAYA DR, PALM BCH GDNS, FL, 33418-1731, UNITED STATES",Active,False,False,False
1131,B&E INVESTMENTS LLC,"CHARBONEAU INVESTMENTS, LLC",602 478 249,74035,"710 7 ST SE, PUYALLUP, WA, 98371, UNITED STATES",Active,False,False,False
1132,B&E INVESTMENTS LLC,"CHARITABLE SEABECK INVESTMENT GROUP, L.L.C.",603 193 390,625198,"13639 COHO RUN NW, BREMERTON, WA, 98312, UNITED STATES",Administratively Dissolved,False,False,False
1133,B&E INVESTMENTS LLC,CHAT BAKE INVESTMENTS LLC,604 842 232,1515159,"3244 E AMES LAKE DR NE, REDMOND, WA, 98053-9142, UNITED STATES",Delinquent,False,False,False
1134,B&E INVESTMENTS LLC,CHINOOK INVESTMENT COMPANY D/B/A KINGERY INVESTMENT COMPANY,601 121 805,610101,,Terminated,True,False,False
1135,B&E INVESTMENTS LLC,CIEL BLEU INVESTMENTS LLC,604 802 674,1492696,"1285 AVENUE OF THE AMERICAS, NEW YORK, NY, 10019-6031, UNITED STATES",Active,False,False,False
1136,B&E INVESTMENTS LLC,"CLEBOB SEATTLE INVESTMENTS, INC.",601 116 486,617426,"711 CAPITOL WAY S, STE 204, OLYMPIA, WA, 98501-1267, UNITED STATES",Active,False,False,False
1137,B&E INVESTMENTS LLC,CLIMATE SMART CONSULTING LLC,604 850 206,1517825,"98 UNION ST APT 508, SEATTLE, WA, 98101-2063, UNITED STATES",Active,False,True,True
1138,B&E INVESTMENTS LLC,"COLD SPRINGS BREWERY INVESTMENTS, LLC",604 316 040,1223721,"804 PERRY VISTA LN, YAKIMA, WA, 98901-8543, UNITED STATES",Active,False,False,False
1139,B&E INVESTMENTS LLC,COLLABORATIVE INVESTMENT CORP,604 436 495,1279304,"11014 19TH AVE SE, STE 8 #242, EVERETT, WA, 98208-5121, UNITED STATES",Voluntarily Dissolved,False,False,False
1140,B&E INVESTMENTS LLC,"COLLABORATIVE INVESTMENTS, LLC",602 567 750,618483,"9029 271ST ST NW, STANWOOD, WA, 98292, UNITED STATES",Administratively Dissolved,False,False,False
1141,B&E INVESTMENTS LLC,"COLUMBIA CENTER INVESTMENTS, LLC",603 053 946,625313,"12112 NW LOWER RIVER ROAD, VANCOUVER, WA, 98660-1016, UNITED STATES",Active,False,False,False
1142,B&E INVESTMENTS LLC,COLUMBIA EAST INVESTMENTS LLC,602 772 772,1105854,"12625 238TH ST SE, SNOHOMISH, WA, 98296-7815, UNITED STATES",Active,False,False,False
1143,B&E INVESTMENTS LLC,"COLUMBIA FREEHOLD INVESTMENT HOLDINGS, LLC",604 928 053,1571094,"1910 FAIRVIEW AVE E STE 300, SEATTLE, WA, 98102-3662, UNITED STATES",Active,False,False,False
1144,B&E INVESTMENTS LLC,COLUMBIA FRESH INVESTMENTS LLC,603 452 836,614239,"19109 NE 102ND AVE, BATTLE GROUND, WA, 98604-6105, UNITED STATES",Active,True,False,False
1145,B&E INVESTMENTS LLC,"COLUMBIA LAKESIDE INVESTMENTS, INC.",603 133 879,111131,"15011 W LAKE GOODWIN RD, STANWOOD, WA, 98292, UNITED STATES",Administratively Dissolved,False,False,False
1146,B&E INVESTMENTS LLC,"COLUMBIA MANAGEMENT INVESTMENT ADVISERS, LLC",603 015 183,115587,"290 CONGRESS STREET, BOSTON, MA, 02110, UNITED STATES",Active,False,False,False
1147,B&E INVESTMENTS LLC,"COLUMBIA MANAGEMENT INVESTMENT DISTRIBUTORS, INC.",602 943 809,631326,"290 CONGRESS ST, BOSTON, MA, 02110, UNITED STATES",Active,False,False,False
1148,B&E INVESTMENTS LLC,"COLUMBIA PARTNERS INVESTMENTS, LLC",603 618 955,117562,"736 8TH AVE NE UNIT 407, ISSAQUAH, WA, 98029-5454, UNITED STATES",Voluntarily Dissolved,False,False,False
1149,B&E INVESTMENTS LLC,"COLUMBIA PROPERTY INVESTMENTS, LLC",602 408 543,615585,"1426 HARVARD AVE #232, SEATTLE, WA, 98122, UNITED STATES",Voluntarily Dissolved,False,False,False
1150,B&E INVESTMENTS LLC,COLUMBIA REAL ESTATE INVESTMENTS INC,603 026 857,1105895,"1447 N WENATCHEE AVE, WENATCHEE, WA, 98801-1154, UNITED STATES",Active,False,False,False
1151,B&E INVESTMENTS LLC,COLUMBIA RIVER HOLDINGS INVESTMENT GROUP LLC,604 715 034,1432296,"444 MARINGO RD, EPHRATA, WA, 98823-1580, UNITED STATES",Delinquent,False,False,False
1152,B&E INVESTMENTS LLC,COLUMBIA RIVER INVESTMENTS LLC,602 842 692,111554,"502 N PERRY AVE, E WENATCHEE, WA, 98802, UNITED STATES",Active,False,False,False
1153,B&E INVESTMENTS LLC,"COLUMBIA RIVER INVESTMENTS, LLC",603 470 088,111555,"3206 SE KNAPP ST, PORTLAND, OR, 97202, UNITED STATES",Active,False,False,False
1154,B&E INVESTMENTS LLC,"COLUMBIA RIVER INVESTMENTS, LLC",601 908 699,626491,,Terminated,True,False,False
1155,B&E INVESTMENTS LLC,COLUMBIA RIVER NW INVESTMENTS LLC,604 457 359,1293420,"15508 NE 64TH AVE, VANCOUVER, WA, 98686-1911, UNITED STATES",Active,False,False,False
1156,B&E INVESTMENTS LLC,"COLUMBIA SHORE INVESTMENTS, INC.",602 596 009,632714,"5047 40TH AVE SW, SEATTLE, WA, 98136, UNITED STATES",Administratively Dissolved,False,False,False
1157,B&E INVESTMENTS LLC,COLUMBIA SPECTRUM INVESTMENTS LLC,604 232 033,1189165,"23239 SUNSERRA LOOP NW # B36, QUINCY, WA, 98848-9112, UNITED STATES",Administratively Dissolved,False,False,False
1158,B&E INVESTMENTS LLC,"COLUMBIA VALLEY INVESTMENTS, INC.",601 318 118,106194,"135 N WENATCHEE AVE, WENATCHEE, WA, 98801-2238, UNITED STATES",Administratively Dissolved,True,False,False
1159,B&E INVESTMENTS LLC,"COLUMBIA VALLEY PROPERTY INVESTMENTS, LP",604 797 844,1485779,"16455 NE 99TH ST, REDMOND, WA, 98052-3044, UNITED STATES",Active,True,False,False
1160,B&E INVESTMENTS LLC,"COLUMBIA VALLEY UNIT INVESTMENTS, LP",604 794 444,1485783,"16455 NE 99TH ST, REDMOND, WA, 98052-3044, UNITED STATES",Active,True,False,False
1161,B&E INVESTMENTS LLC,"COLUMBIA VIEW INVESTMENTS, LLC",602 677 580,618991,"2098 STATE ROUTE 105, GRAYLAND, WA, 98547-9602, UNITED STATES",Active,False,False,False
1162,B&E INVESTMENTS LLC,"COLVILLE TRIBAL GOVERNMENT BUILDING INVESTMENT, INC.",603 434 195,1105954,"21 COLVILLE ST, NESPELEM, WA, 99155-0000, UNITED STATES",Administratively Dissolved,False,False,False
1163,B&E INVESTMENTS LLC,"COMMUNITY BUILDERS INVESTMENTS, LLC",604 051 102,117228,"523 BROADWAY AVE E #347, SEATTLE, WA, 98102, UNITED STATES",Administratively Dissolved,False,False,False
1164,B&E INVESTMENTS LLC,CONCORDIA BUSINESS & INVESTMENT DEVELOPMENT  L.L.C.,603 410 836,120649,,,True,True,True
1165,B&E INVESTMENTS LLC,CONCORDIA BUSINESS & INVESTMENT DEVELOPMENT HOLDINGS  L.L.C.,603 410 836,120649,"15 S. GRADY WAY, SUITE LL 18, RENTON, WA, 98057, UNITED STATES",Active,False,True,True
1166,B&E INVESTMENTS LLC,CONWELL BROTHERS INVESTMENTS L.P.,601 311 822,1106603,,Inactive,True,False,False
1167,B&E INVESTMENTS LLC,COWBOY SEATTLE INVESTMENTS LLC,604 071 781,634983,"27908 28TH AVE NW, STANWOOD, WA, 98292, UNITED STATES",Active,False,False,False
1168,B&E INVESTMENTS LLC,COWBOY WOODINVILLE INVESTMENTS LLC,604 071 069,640733,"27908 28TH AVE NW, STANWOOD, WA, 98292-6454, UNITED STATES",Active,False,False,False
1169,B&E INVESTMENTS LLC,CPPIB CREDIT INVESTMENTS III INC.,603 543 353,125616,"ONE QUEEN ST E STE 2500, TORONTO, ON, M5C 2W5, CANADA",Active,False,False,False
1170,B&E INVESTMENTS LLC,CROSS BORDER INVESTMENTS LLC,604 516 573,1311919,"233 MIDDLEFIELD RD, BELLINGHAM, WA, 98225-7721, UNITED STATES",Voluntarily Dissolved,False,False,False
1171,B&E INVESTMENTS LLC,CROSS BORDER INVESTMENTS LLC,605 233 910,1663098,"2006 GRANDVIEW RD, FERNDALE, WA, 98248-9309, UNITED STATES",Active,False,False,False
1172,B&E INVESTMENTS LLC,"CROSSBEAM INVESTMENTS, LLP",602 973 288,627298,"401 2ND AVE S STE 200, SEATTLE, WA, 98104, UNITED STATES",Active,False,False,False
1173,B&E INVESTMENTS LLC,CRYSTALGLOBEINVESTMENTS LLC,604 486 020,1296903,"9330 NE VAN MALL DRIVE, STE. 203 #124, VANCOUVER, WA, 98662, UNITED STATES",Active,False,False,False
1174,B&E INVESTMENTS LLC,"CS BEST INVESTMENTS, INC.",602 753 747,128013,"19233 STATE HWY 2, MONROE, WA, 98272, UNITED STATES",Administratively Dissolved,False,False,False
1175,B&E INVESTMENTS LLC,CUBE-H INVESTMENTS,601 151 508,117020,"50 116TH AVE SE STE 201, BELLEVUE, WA, 98004-6436, UNITED STATES",Active,False,False,False
1176,B&E INVESTMENTS LLC,CUTHBERT INVESTMENTS LLC,603 190 276,646678,"999 THIRD AVENUE, SUITE 3000, SEATTLE, WA, 98104-4088, UNITED STATES",Administratively Dissolved,False,False,False
1177,B&E INVESTMENTS LLC,CZL BEL RED INVESTMENT LLC,604 736 955,1447199,"325 118TH AVE SE STE 100, BELLEVUE, WA, 98005-3539, UNITED STATES",Administratively Dissolved,False,False,False
1178,B&E INVESTMENTS LLC,D & B HOME INVESTMENTS LLC,603 178 422,637754,"29227 SE 256TH STREET, RAVENSDALE, WA, 98051, UNITED STATES",Administratively Dissolved,False,False,False
1179,B&E INVESTMENTS LLC,D & L BEST INVESTMENTS LLC,602 720 311,651273,"2306 127TH PL SE, EVERETT, WA, 98208, UNITED STATES",Administratively Dissolved,False,False,False
1180,B&E INVESTMENTS LLC,D & S ROBERTSON INVESTMENTS LLC,602 688 940,130960,"6221 5TH AVE NW, SEATTLE, WA, 98107-2122, UNITED STATES",Active,False,False,False
1181,B&E INVESTMENTS LLC,"D & T CAMPBELL INVESTMENTS, LLC",603 302 757,636582,"1104 MAJESTAD LANE, CHULA VISTA, CA, 91910, UNITED STATES",Active,False,False,False
1182,B&E INVESTMENTS LLC,D&D BUTLER INVESTMENTS LLC,604 848 560,1522064,"4002 MAIN ST, UNION GAP, WA, 98903-2041, UNITED STATES",Active,False,False,False
1183,B&E INVESTMENTS LLC,"D&H BLANKENSHIP INVESTMENTS, LLC",603 479 935,640883,"22230 N. MADISON RD, MEAD, WA, 99021, UNITED STATES",Active,False,False,False
1184,B&E INVESTMENTS LLC,D. BENSON INVESTMENTS LLC,602 975 779,639597,"2217 NE 96TH COURT, VANCOUVER, WA, 98664, UNITED STATES",Inactive,False,False,False
1185,B&E INVESTMENTS LLC,"D.B.E. INVESTMENT, INC.",601 489 340,134801,"1325 FOURTH AVE STE 940, SEATTLE, WA, 98101, UNITED STATES",Administratively Dissolved,False,False,False
1186,B&E INVESTMENTS LLC,DAMCAB GATES INVESTMENTS LLC,604 675 015,1402396,"100 CENTERLANE DR, BURBANK, WA, 99323-9694, UNITED STATES",Active,False,False,False
1187,B&E INVESTMENTS LLC,"DANIEL BOONE INVESTMENTS, LLC",603 436 152,652072,"402 W RAILROAD ST, CLE ELUM, WA, 98922, UNITED STATES",Administratively Dissolved,False,False,False
1188,B&E INVESTMENTS LLC,DATE AND LABROSSE INVESTMENTS LLC,602 385 443,155941,"1826 S LIMERICK DR, PO BOX 1308, VERADALE, WA, 99037, UNITED STATES",Terminated,False,False,False
1189,B&E INVESTMENTS LLC,"DAUBENSPECK INVESTMENTS, LLC",602 182 210,133788,,Inactive,True,False,False
1190,B&E INVESTMENTS LLC,DAVID KITZMILLER BUSINESS INVESTMENTS LLC,604 734 626,1443898,"2929 76TH AVE SE APT 208, MERCER ISLAND, WA, 98040-2716, UNITED STATES",Administratively Dissolved,False,False,False
1191,B&E INVESTMENTS LLC,DAYBREAK INVESTMENTS LLC,604 860 578,1532126,"6141 TROON AVE SW, PORT ORCHARD, WA, 98367-9196, UNITED STATES",Active,False,False,False
1192,B&E INVESTMENTS LLC,DB PROPERTIES & INVESTMENTS LLC,604 547 362,1328168,"24023 26TH DR SE, BOTHELL, WA, 98021-6521, UNITED STATES",Voluntarily Dissolved,False,False,False
1193,B&E INVESTMENTS LLC,DB REAL INVESTMENTS LLC,604 023 000,134547,"24620 PACIFIC HWY S, KENT, WA, 98032-4001, UNITED STATES",Active,False,False,False
1194,B&E INVESTMENTS LLC,DBL ALYS BEACH INVESTMENT LLC,604 654 172,1392956,"13110 NE 177TH PL # 315, WOODINVILLE, WA, 98072-5740, UNITED STATES",Active,False,False,False
1195,B&E INVESTMENTS LLC,DEBAUCHERY INVESTMENTS LLC,604 477 754,1299765,"26395 ROAD U SW, MATTAWA, WA, 99349-8206, UNITED STATES",Active,False,False,False
1196,B&E INVESTMENTS LLC,DEEP BLUE INVESTMENTS LLC,603 274 284,158044,"1577 PARKVIEW DR NE, BAINBRIDGE IS, WA, 98110-2305, UNITED STATES",Administratively Dissolved,False,False,False
1197,B&E INVESTMENTS LLC,"DELBRIDGE INVESTMENTS, INC.",602 577 709,1109043,"21516 NE 242ND AVE, BATTLE GROUND, WA, 98604, UNITED STATES",Inactive,False,False,False
1198,B&E INVESTMENTS LLC,DELEO BARNES INVESTMENTS LLC,604 482 801,1296957,"3913 W MOONLIGHT CT, SPOKANE, WA, 99208-9623, UNITED STATES",Terminated,False,False,False
1199,B&E INVESTMENTS LLC,DEMIN & BRUSSEAU INVESTMENT LLC,603 159 140,1109119,"3822 SHELBY RD, LYNNWOOD, WA, 98087, UNITED STATES",Administratively Dissolved,False,False,False
1200,B&E INVESTMENTS LLC,DENT AND DEBORAH HALES INVESTMENTS LIMITED PARTNERSHIP,602 557 838,649781,"14148 194TH AVE NE, WOODINVILLE, WA, 98077, UNITED STATES",Inactive,False,False,False
1201,B&E INVESTMENTS LLC,DEVBLOCK TECHNOLOGIES INVESTMENTS LLC,605 100 313,1642220,"1100 BELLEVUE WAY NE STE 8A-226, BELLEVUE, WA, 98004-4280, UNITED STATES",Active,False,False,False
1202,B&E INVESTMENTS LLC,DGILBERTINVESTMENT LLC,604 950 032,1582635,"2657 W BENCH RD, OTHELLO, WA, 99344-8903, UNITED STATES",Active,False,False,False
1203,B&E INVESTMENTS LLC,"DIAMOND JUBILEE INVESTMENTS, LLC.",604 352 482,1240592,"22712 30TH CT SE, BOTHELL, WA, 98021-4214, UNITED STATES",Administratively Dissolved,True,False,False
1204,B&E INVESTMENTS LLC,"DIAS-SABEY INVESTMENTS, LLC",603 596 788,644021,"7900 SE 28TH ST STE 500, MERCER ISLAND, WA, 98040-6004, UNITED STATES",Voluntarily Dissolved,False,False,False
1205,B&E INVESTMENTS LLC,DK BROECKEL INVESTMENTS L.L.C.,604 632 051,1370021,"214 S MAIN ST, LACROSSE, WA, 99143, UNITED STATES",Active,False,False,False
1206,B&E INVESTMENTS LLC,DM BELFAIR INVESTMENTS II LLC,603 450 030,152359,"3710 GRANDVIEW ST, GIG HARBOR, WA, 98335-1150, UNITED STATES",Active,True,False,False
1207,B&E INVESTMENTS LLC,DM BELFAIR INVESTMENTS LLC,603 333 765,147433,"3710 GRANDVIEW ST, GIG HARBOR, WA, 98335-1150, UNITED STATES",Active,True,False,False
1208,B&E INVESTMENTS LLC,"DOBLER LEGACY INVESTMENTS, LLC",602 677 612,141953,"3726 BROADWAY, SUITE 301, EVERETT, WA, 98201-3788, UNITED STATES",Active,False,False,False
1209,B&E INVESTMENTS LLC,"DOBSON & PARENTE INVESTMENTS, LLC",604 046 554,665855,"5408 36TH AVE NW, A103, GIG HARBOR, WA, 98335-8255, UNITED STATES",Voluntarily Dissolved,False,False,False
1210,B&E INVESTMENTS LLC,"DOOBIEUS INVESTMENTS, LLC",604 474 338,1290820,"4136 46TH AVE SW, 3510 FREMONT AVENUE NORTH, SEATTLE, WA, 98116-4126, UNITED STATES",Administratively Dissolved,False,False,False
1211,B&E INVESTMENTS LLC,"DOOLEY ARBOR ROSE INVESTMENTS, LLC",603 079 665,661883,"2901 THORNHILL RD, PUYALLUP, WA, 98374-6321, UNITED STATES",Active,False,False,False
1212,B&E INVESTMENTS LLC,"DOUBLE A INVESTMENTS USA, LLC",602 154 528,666027,,Terminated,True,False,False
1213,B&E INVESTMENTS LLC,"DOUBLE AA INVESTMENTS, LLC",604 281 642,1213981,"27820 W DRUMHELLER RD, CHENEY, WA, 99004-7921, UNITED STATES",Administratively Dissolved,False,False,False
1214,B&E INVESTMENTS LLC,"DOUBLE B INVESTMENTS, L.L.C.",602 014 056,666031,,Administratively Dissolved,True,False,False
1215,B&E INVESTMENTS LLC,"DOUBLE BLACK INVESTMENTS, LLC",604 295 079,1211972,"2532 W FRANCIS AVE, SPOKANE, WA, 99205-7012, UNITED STATES",Active,False,False,False
1216,B&E INVESTMENTS LLC,DOUBLE CLUTCH INVESTMENTS LLC,602 690 806,148985,"9116 E SPRAGUE AVE # 192, SPOKANE VLY, WA, 99206-3601, UNITED STATES",Administratively Dissolved,False,False,False
1217,B&E INVESTMENTS LLC,"DOUBLE D INVESTMENTS, LLC",604 647 846,1382821,"10210 SHOULTES RD, MARYSVILLE, WA, 98270-8302, UNITED STATES",Voluntarily Dissolved,False,False,False
1218,B&E INVESTMENTS LLC,"DOUBLE DA INVESTMENTS, LLC",602 628 343,148992,"2825 COLBY AVE STE 206, EVERETT, WA, 98201-3553, UNITED STATES",Administratively Dissolved,False,False,False
1219,B&E INVESTMENTS LLC,DOUBLE DIAMOND INVESTMENTS LLC,603 131 209,131702,"431 BOUNDARY RD, METALINE, WA, 99152, UNITED STATES",Terminated,False,False,False
1220,B&E INVESTMENTS LLC,"DOUBLE DIAMOND INVESTMENTS, LLC",602 850 859,149055,"338 N 137TH ST, SEATTLE, WA, 98133-7409, UNITED STATES",Active,False,False,False
1221,B&E INVESTMENTS LLC,"DOUBLE EAGLE INVESTMENTS, LLC",604 543 999,1396755,"1191 2ND AVE, STE. 1800, SEATTLE, WA, 98101, UNITED STATES",Active,False,False,False
1222,B&E INVESTMENTS LLC,"DOUBLE G INVESTMENTS, LLC",603 244 342,662306,"200 BROADMOOR ST, RICHLAND, WA, 99352, UNITED STATES",Administratively Dissolved,False,False,False
1223,B&E INVESTMENTS LLC,DOUBLE H INVESTMENTS LLC,604 150 725,647429,"529 W COLUMBIA DR, KENNEWICK, WA, 99336, UNITED STATES",Administratively Dissolved,False,False,False
1224,B&E INVESTMENTS LLC,"DOUBLE H INVESTMENTS, LLC",605 023 065,1632680,"148 KAKELA RD, WINLOCK, WA, 98596-9642, UNITED STATES",Active,False,False,False
1225,B&E INVESTMENTS LLC,"DOUBLE HAPPINESS INVESTMENT , LLC",604 324 953,1228308,,,True,True,True
1226,B&E INVESTMENTS LLC,"DOUBLE HAPPINESS INVESTMENT, LLC",604 324 953,1228308,"1302 W CHAUCER AVE, SPOKANE, WA, 99208-8676, UNITED STATES",Active,False,True,True
1227,B&E INVESTMENTS LLC,DOUBLE I INVESTMENTS LLC,604 211 293,1179705,"10005 151ST PL SE, SNOHOMISH, WA, 98296, UNITED STATES",Active,False,False,False
1228,B&E INVESTMENTS LLC,"DOUBLE INVESTMENTS, LLC",603 368 393,662311,"4840 FOREST AVE SE, MERCER ISLAND, WA, 98040-4602, UNITED STATES",Active,False,False,False
1229,B&E INVESTMENTS LLC,DOUBLE J INVESTMENTS LLC,603 578 377,105235,"116 NOBLE FIR LN, CHEHALIS, WA, 98532, UNITED STATES",Active,False,False,False
1230,B&E INVESTMENTS LLC,DOUBLE J. INVESTMENT PROPERTIES L.L.C.,602 453 305,658065,"7217 E STONEMAN RD, SPOKANE, WA, 99217-8001, UNITED STATES",Administratively Dissolved,False,False,False
1231,B&E INVESTMENTS LLC,"DOUBLE K INVESTMENTS, INC.",602 952 653,647492,"11734 HIGH SIERRA LN NW #201, SILVERDALE, WA, 98383, UNITED STATES",Inactive,False,False,False
1232,B&E INVESTMENTS LLC,DOUBLE L INVESTMENTS LLC,604 084 798,662390,"38585 SWANSON RIVER RD, STERLING, AK, 99672, UNITED STATES",Active,False,False,False
1233,B&E INVESTMENTS LLC,DOUBLE LL INVESTMENT LLC,604 368 365,1250233,"5210 NE 8TH PL, RENTON, WA, 98059-4699, UNITED STATES",Administratively Dissolved,False,False,False
1234,B&E INVESTMENTS LLC,DOUBLE M INVESTMENTS LLC,603 572 184,656013,"500 N WILLOW ST, ELLENSBURG, WA, 98926, UNITED STATES",Administratively Dissolved,False,False,False
1235,B&E INVESTMENTS LLC,"DOUBLE PLAY INVESTMENTS, LLC",602 606 917,647499,"10359 172ND AVENUE SE, NEWCASTLE, WA, 98059, UNITED STATES",Administratively Dissolved,False,False,False
1236,B&E INVESTMENTS LLC,"DOUBLE R INVESTMENTS, LLC",601 877 891,662396,,Inactive,True,False,False
1237,B&E INVESTMENTS LLC,DOUBLE S INVESTMENTS LLC,602 505 789,656350,"11040 MAIN ST STE 280, BELLEVUE, WA, 98004-6363, UNITED STATES",Active,False,False,False
1238,B&E INVESTMENTS LLC,"DOUBLE T INVESTMENTS, LLC",602 950 255,656353,"9768 RD V NW, QUINCY, WA, 98848, UNITED STATES",Administratively Dissolved,False,False,False
1239,B&E INVESTMENTS LLC,DOUBLE TREE INVESTMENT CORP.,603 021 221,662400,"502 BOUNDARY BLVD, AUBURN, WA, 98001-6503, UNITED STATES",Active,False,False,False
1240,B&E INVESTMENTS LLC,DOUBLE VC INVESTMENT LLC,602 563 681,666133,"3202 E AMES LAKE DR NE, KIRKLAND, WA, 98033, UNITED STATES",Active,False,False,False
1241,B&E INVESTMENTS LLC,DOUBLE Y INVESTMENT CO.,578 018 772,647558,"10508 MARINE VIEW DR, MUKILTEO, WA, 98275-4510, UNITED STATES",Active,False,False,False
1242,B&E INVESTMENTS LLC,DOUBLEDOWN INVESTMENTS LLC,604 352 021,1240814,"521 15TH AVE, KIRKLAND, WA, 98033-5608, UNITED STATES",Administratively Dissolved,False,False,False
1243,B&E INVESTMENTS LLC,DOUBLEM'S INVESTMENT GROUP LLC,604 568 709,1334517,"3405 GRANDVIEW STREET, GIG HARBOR, WA, 98335, UNITED STATES",Active,False,False,False
1244,B&E INVESTMENTS LLC,"DOUGLAS B. SPARKS PROPERTY INVESTMENTS, LLC",602 697 709,667804,"2222 MERIDIAN AVE #A, EDGEWOOD, WA, 98371, UNITED STATES",Administratively Dissolved,False,False,False
1245,B&E INVESTMENTS LLC,"DR. CHARLES B. H. HOUGH AND DR. P.Z. PEARCE PROPERTY INVESTMENT, LLC",602 400 931,669904,"19 N 7TH ST, CHENEY, WA, 99004, UNITED STATES",Active,False,False,False
1246,B&E INVESTMENTS LLC,"DREAM BUILDERS INVESTMENTS, LLC",602 299 352,106166,"16527 LONGMIRE RD SE, YELM, WA, 98597, UNITED STATES",Voluntarily Dissolved,False,False,False
1247,B&E INVESTMENTS LLC,"DRG BELLPAC INVESTMENT, LLC",603 387 744,664401,"135 N WENATCHEE AVE, WENATCHEE, WA, 98801-2238, UNITED STATES",Active,True,False,False
1248,B&E INVESTMENTS LLC,DUBOIS PROPERTY INVESTMENTS LLC,603 520 693,658633,"5010 SW 317TH LN, T101, FEDERAL WAY, WA, 98023-3770, UNITED STATES",Active,False,False,False
1249,B&E INVESTMENTS LLC,"DUBOSE MODEL HOME INVESTMENTS #108, LTD DBA DUBOSE GP MANAGEMENT III, L.P.",602 469 372,658634,"14405 WALTERS RD STE 319, HOUSTON, TX, 77014, UNITED STATES",Terminated,True,False,False
1250,B&E INVESTMENTS LLC,"DUBOSE MODEL HOME INVESTMENTS #109, LTD DBA DUBOSE MODEL HOME INVESTMENTS #109, L.P.",602 469 374,658635,"3040 POST OAK BLVD STE 770, HOUSTON, TX, 77056, UNITED STATES",Terminated,False,False,False
1251,B&E INVESTMENTS LLC,"DUBOSE MODEL HOME INVESTMENTS #110, LTD. DBA DUBOSE MODEL HOME INVESTMENTS #110, L.P.",602 469 376,148148,,Terminated,True,False,False
1252,B&E INVESTMENTS LLC,"DUBOSE MODEL HOME INVESTMENTS #111, LTD. DBA DUBOSE MODEL HOME INVESTMENTS #111, L.P.",602 469 379,651575,"14405 WALTERS RD STE 319, HOUSTON, TX, 77014, UNITED STATES",Terminated,True,False,False
1253,B&E INVESTMENTS LLC,"DUBOSE MODEL HOME INVESTMENTS #112, LTD. DBA DUBOSE MODEL HOME INVESTMENTS #112, L.P.",602 468 741,665657,"14405 WALTERS RD #310, HOUSTON, TX, 77014, UNITED STATES",Terminated,True,False,False
1254,B&E INVESTMENTS LLC,"DUBOSE MODEL HOME INVESTMENTS #113, LTD. DBA DUBOSE MODEL HOME INVESTMENTS #113, L.P.",602 468 735,660911,"14405 WALTERS RD #310, HOUSTON, TX, 77014, UNITED STATES",Terminated,True,False,False
1255,B&E INVESTMENTS LLC,"DUBOSE MODEL HOME INVESTMENTS #114, LTD. DBA DUBOSE MODEL HOME INVESTMENTS #114, L.P.",602 622 777,157063,"14405 WALTERS RD #310, HOUSTON, TX, 77014, UNITED STATES",Terminated,True,False,False
1256,B&E INVESTMENTS LLC,"DUBOSE MODEL HOME INVESTMENTS #115, L.P.",602 622 776,157064,"14405 WALTERS RD STE 310, HOUSTON, TX, 77014, UNITED STATES",Terminated,True,False,False
1257,B&E INVESTMENTS LLC,"DUBOSE MODEL HOME INVESTMENTS #116 LTD. DBA DUBOSE MODEL HOME INVESTMENTS #116, L.P.",602 622 775,669208,"14405 WALTERS RD STE 310, HOUSTON, TX, 77014, UNITED STATES",Terminated,True,False,False
1258,B&E INVESTMENTS LLC,"DUBRUL & FORTENBERRY INVESTMENTS, LLC",602 867 299,171847,"18805 SE WAX RD, KENT, WA, 98042, UNITED STATES",Administratively Dissolved,False,False,False
1259,B&E INVESTMENTS LLC,DUFF BUSINESS INVESTMENTS LLC,605 094 949,1641001,"9791 US HIGHWAY 12, RANDLE, WA, 98377, UNITED STATES",Active,False,False,False
1260,B&E INVESTMENTS LLC,DWEEZEL BOMBE INVESTMENTS LLC,602 453 702,652612,"3308 19TH AVE S, SEATTLE, WA, 98144, UNITED STATES",Active,False,False,False
