,SearchTerm,BusinessName,UBINumber,BusinessId,Address,Status,address_match,ubi_match,id_match
1575,B&E INVESTMENTS LLC,"MARK W. HUBER INVESTMENTS, LLC",602 351 868,340830,"1003 N LONG RD, SPOKANE VLY, WA, 99016-9553, UNITED STATES",Active,False,False,False
1576,B&E INVESTMENTS LLC,"MARLEY BEAR INVESTMENTS, LLC",604 971 893,1599666,"2219 34TH AVE S, SEATTLE, WA, 98144-4926, UNITED STATES",Active,False,False,False
1577,B&E INVESTMENTS LLC,MARUNABE INTERNATIONAL TRADE & INVESTMENT JOINT STOCK LLC,604 308 308,1221761,,,True,True,True
1578,B&E INVESTMENTS LLC,MARUNABE KOKUSAI INVESTMENTS & SECURITIES GROUP LLC,604 389 233,1255826,,,True,True,True
1579,B&E INVESTMENTS LLC,MATTHEWS BEACH INVESTMENTS LLC,604 182 322,311165,"2151 N NORTHLAKE WAY, SUITE #200, SEATTLE, WA, 98103-9157, UNITED STATES",Active,False,False,False
1580,B&E INVESTMENTS LLC,"MAY BROTHERS REAL ESTATE INVESTMENT, LLC",603 177 134,320854,"300 N WENATCHEE AVE, WENATCHEE, WA, 98801-2012, UNITED STATES",Active,False,False,False
1581,B&E INVESTMENTS LLC,"MB REAL ESTATE INVESTMENTS, LLC",603 102 760,821959,"3425 SOUTH 176TH STREET #131, SEATAC, WA, 98188, UNITED STATES",Administratively Dissolved,False,False,False
1582,B&E INVESTMENTS LLC,"MBOTE INVESTMENTS, LLC",604 796 446,1486810,"6650 CASCADE AVE, GIG HARBOR, WA, 98335-1975, UNITED STATES",Active,False,False,False
1583,B&E INVESTMENTS LLC,"MBS RENTON INVESTMENTS, LLC",603 550 553,344409,"13424 179TH AVE NE, REDMOND, WA, 98052-1103, UNITED STATES",Active,False,False,False
1584,B&E INVESTMENTS LLC,"MC TINY BUBBLES INVESTMENT, LLC",602 747 445,833459,"1000 SECOND AVE STE 1200, SEATTLE, WA, 98104, UNITED STATES",Administratively Dissolved,False,False,False
1585,B&E INVESTMENTS LLC,"MCBE INVESTMENTS, LLC",602 537 484,344486,"23018 171ST AVE SE, MONROE, WA, 98272, UNITED STATES",Inactive,False,False,False
1586,B&E INVESTMENTS LLC,MCBRIDE FAMILY INVESTMENTS L.L.C.,602 177 403,833535,"10425 OWL HOLLOW PL NW, SILVERDALE, WA, 98383-7560, UNITED STATES",Active,False,False,False
1587,B&E INVESTMENTS LLC,"MCROBERTS INVESTMENTS, INC.",601 089 540,811834,,Terminated,True,False,False
1588,B&E INVESTMENTS LLC,MEDANO BEACH INVESTMENTS LLC,603 430 653,204156,"10650 NE 9TH PL #2526, BELLEVUE, WA, 98004, UNITED STATES",Administratively Dissolved,False,False,False
1589,B&E INVESTMENTS LLC,"MEL SHERBOURNE INVESTMENTS, LLC",604 771 173,1470644,"701 WESTERN AVE APT 109, MEDFORD, OR, 97501-1884, UNITED STATES",Active,False,False,False
1590,B&E INVESTMENTS LLC,MERCER ISLAND NOBLE INVESTMENT LLC,603 622 899,1132794,"620 86TH AVE NE, MEDINA, WA, 98039-5312, UNITED STATES",Active,True,False,False
1591,B&E INVESTMENTS LLC,MERRILL BEHNKE INVESTMENTS LLC,603 456 567,318880,"601 UNION ST STE 3016, SEATTLE, WA, 98101, UNITED STATES",Active,False,False,False
1592,B&E INVESTMENTS LLC,"MEYDENBAUER BAY INVESTMENTS, LTD.",601 855 819,316764,,Inactive,True,False,False
1593,B&E INVESTMENTS LLC,MEYDENBAUER INVESTMENTS INCORPORATED,603 441 150,316766,"12025 WILLOWS RD NE, REDMOND, WA, 98052-2001, UNITED STATES",Active,False,False,False
1594,B&E INVESTMENTS LLC,MEYDENBAUER INVESTMENTS LLC,603 425 081,839413,,Administratively Dissolved,True,False,False
1595,B&E INVESTMENTS LLC,"MILESTONE-BELL INVESTMENT, LLC",602 440 121,333582,,Administratively Dissolved,True,False,False
1596,B&E INVESTMENTS LLC,MILLER FAMILY TIMBERLAND INVESTMENTS LLC,603 056 600,333566,"161 NW 56TH ST, SEATTLE, WA, 98107-2024, UNITED STATES",Active,False,False,False
1597,B&E INVESTMENTS LLC,MJ&M BUSINESS GROUP AND INVESTMENT ENTERPRISES INC.,604 372 508,1247733,"7470 GLENWOOD RD SW, PORT ORCHARD, WA, 98367-8301, UNITED STATES",Active,False,False,False
1598,B&E INVESTMENTS LLC,MJB RESIDENTIAL INVESTMENTS LLC,603 601 289,1133766,"3733 221ST PLACE SE, SAMMAMISH, WA, 98075, UNITED STATES",Administratively Dissolved,False,False,False
1599,B&E INVESTMENTS LLC,MK BUSINESS INVESTMENT CO LLC,604 644 207,1375842,"14601 NE 90TH ST, VANCOUVER, WA, 98682-2603, UNITED STATES",Administratively Dissolved,False,False,False
1600,B&E INVESTMENTS LLC,MOBEL INVESTMENTS LLC,603 453 137,823420,"22704 SE 22ND PL, SAMMAMISH, WA, 98075-9512, UNITED STATES",Administratively Dissolved,False,False,False
1601,B&E INVESTMENTS LLC,MOBERG INVESTMENT PROPERTIES LLC,604 610 640,1359971,"9627 SUPERIOR CT NE, MOSES LAKE, WA, 98837-8528, UNITED STATES",Active,False,False,False
1602,B&E INVESTMENTS LLC,MOBILE COURT INVESTMENTS LLC,604 142 401,868976,"1201 SE 192ND AVE, VANCOUVER, WA, 98683-9514, UNITED STATES",Active,False,False,False
1603,B&E INVESTMENTS LLC,"MOBILITIE INVESTMENTS III, LLC",603 186 858,827514,"660 NEWPORT CENTER DR STE 200, NEWPORT BEACH, CA, 92660-6403, UNITED STATES",Withdrawn,True,False,False
1604,B&E INVESTMENTS LLC,"MOBILITIE INVESTMENTS III-A, LLC",604 794 414,1483516,"660 NEWPORT CENTER DR STE 200, NEWPORT BEACH, CA, 92660-6403, UNITED STATES",Active,True,False,False
1605,B&E INVESTMENTS LLC,"MOBILITIE INVESTMENTS III-B, LLC",604 798 129,1485999,"660 NEWPORT CENTER DR STE 200, NEWPORT BEACH, CA, 92660-6403, UNITED STATES",Active,True,False,False
1606,B&E INVESTMENTS LLC,"MOBILITIE INVESTMENTS III-C, LLC",604 801 905,1485998,"660 NEWPORT CENTER DR STE 200, NEWPORT BEACH, CA, 92660-6403, UNITED STATES",Active,True,False,False
1607,B&E INVESTMENTS LLC,MOEBEY FAMILY INVESTMENTS LLC,604 742 952,1449004,"4115 DUROC LN, PASCO, WA, 99301-9248, UNITED STATES",Active,False,False,False
1608,B&E INVESTMENTS LLC,"MOONBEAM RANCH INVESTMENTS, LLC",603 367 664,339969,"105 DOVE HOLLOW RD, CHELAN, WA, 98816, UNITED STATES",Administratively Dissolved,False,False,False
1609,B&E INVESTMENTS LLC,MORARA NYAMBANE INVESTMENTS LLC,604 766 016,1464166,"32114 20TH LN SW APT 132, FEDERAL WAY, WA, 98023-8727, UNITED STATES",Active,False,False,False
1610,B&E INVESTMENTS LLC,"MORELLI BROTHERS INVESTMENTS NO 1, LLC",603 394 843,874180,"11911 NE 1ST ST, STE 101, BELLEVUE, WA, 98005-3055, UNITED STATES",Active,False,False,False
1611,B&E INVESTMENTS LLC,MORETTO & BRIDGES INVESTMENTS LLC,604 771 120,1467002,"2931 MERIDIAN ST, BELLINGHAM, WA, 98225-1721, UNITED STATES",Active,False,False,False
1612,B&E INVESTMENTS LLC,"MOUNT BAKER INVESTMENTS, LLC",603 243 375,341245,"1019 LENORA CT, BELLINGHAM, WA, 98225-6839, UNITED STATES",Active,False,False,False
1613,B&E INVESTMENTS LLC,MT. BAKER INVESTMENT PROPERTIES LLC,602 910 708,843690,"2617 NORTHSHORE RD, BELLINGHAM, WA, 98226-9487, UNITED STATES",Active,False,False,False
1614,B&E INVESTMENTS LLC,"MULBERRY INVESTMENTS, LLC",605 022 970,1631565,"4340 BORGEN BLVD APT 1250, GIG HARBOR, WA, 98332-7002, UNITED STATES",Active,False,False,False
1615,B&E INVESTMENTS LLC,"MULLER-BROBERG INVESTMENTS, L.L.C.",602 624 452,851775,"15025 70TH AVE NE, BOTHELL, WA, 98011, UNITED STATES",Active,False,False,False
1616,B&E INVESTMENTS LLC,MURPHY BROTHERS INVESTMENTS LLC,604 478 408,1292083,,,True,True,True
1617,B&E INVESTMENTS LLC,"MURPHY TIMBER INVESTMENTS, LLC",604 119 628,828480,"505 ELMA MCCLEARY RD, ELMA, WA, 98541, UNITED STATES",Active,False,False,False
1618,B&E INVESTMENTS LLC,MUSTAFA BAQI WORLDWIDE INVESTMENTS LLC,604 953 184,1588675,"100 N HOWARD ST STE R, SPOKANE, WA, 99201-0508, UNITED STATES",Active,True,False,False
1619,B&E INVESTMENTS LLC,"MY BIG CHINESE ROOSTER INVESTMENT COMPANY, LLC",603 181 180,1135007,"5500 RAINIER AVE S, SEATTLE, WA, 98118, UNITED STATES",Active,False,False,False
1620,B&E INVESTMENTS LLC,MZ  TANGIBLE INVESTMENT LLC,604 007 392,118786,,,True,True,True
1621,B&E INVESTMENTS LLC,MZ TANGIBLE INVESTMENT LLC,604 007 392,118786,"11223 19TH AVE NE, EVERETT, WA, 98208, UNITED STATES",Active,False,True,True
1622,B&E INVESTMENTS LLC,"NATIVE COLLECTIBLE INVESTMENTS, LLC",604 213 519,1177151,"1413 N OAKES ST, A, TACOMA, WA, 98406-7416, UNITED STATES",Administratively Dissolved,False,False,False
1623,B&E INVESTMENTS LLC,"NATIVE TRIBE INVESTMENTS, LLC",603 563 829,347262,"606 STAR FLOWER CT, BELLINGHAM, WA, 98226, UNITED STATES",Administratively Dissolved,False,False,False
1624,B&E INVESTMENTS LLC,"NBE INVESTMENTS, LLC",603 411 189,857482,"12425 234TH ST SE, SNOHOMISH, WA, 98296-4917, UNITED STATES",Active,False,False,False
1625,B&E INVESTMENTS LLC,"NBP KING JAMES GATE INVESTMENTS, LLC",603 554 891,883432,"1640 NW IRVING ST, PORTLAND, OR, 97209-2213, UNITED STATES",Withdrawn,False,False,False
1626,B&E INVESTMENTS LLC,NECK BEARD INVESTMENTS LLC,604 124 877,841814,"2120 N 45TH ST, SEATTLE, WA, 98103-6902, UNITED STATES",Active,False,False,False
1627,B&E INVESTMENTS LLC,NEIGHBORHOOD HOME INVESTMENTS II LLC,603 552 399,345252,"PO BOX 257, OLYMPIA, WA, 98507-0257, UNITED STATES",Active,True,False,False
1628,B&E INVESTMENTS LLC,"NEIGHBORHOOD HOME INVESTMENTS, LLC",603 266 225,337729,"12420 SW 276TH ST, VASHON, WA, 98070-8305, UNITED STATES",Active,False,False,False
1629,B&E INVESTMENTS LLC,"NELSON BROTHERS INVESTMENTS, LLC",604 618 065,1364143,"3930 BURWELL ST, BREMERTON, WA, 98312-3566, UNITED STATES",Active,False,False,False
1630,B&E INVESTMENTS LLC,NEPTUNE BEACH INVESTMENTS LLC,603 137 534,347474,"4887 BEACH WAY, FERNDALE, WA, 98248, UNITED STATES",Active,False,False,False
1631,B&E INVESTMENTS LLC,NEUBERGER BERMAN INVESTMENT ADVISERS LLC,604 027 263,864748,"1290 AVENUE OF THE AMERICAS, FL23, NEW YORK, NY, 10104-0011, UNITED STATES",Active,False,False,False
1632,B&E INVESTMENTS LLC,"NEW BEGINNINGS INVESTMENTS, LLC",603 472 394,859417,"19810 OLD HIGHWAY 99 SW STE. 7, ROCHESTER, WA, 98579-8684, UNITED STATES",Active,False,False,False
1633,B&E INVESTMENTS LLC,NEWBERRY INVESTMENTS INC,602 995 447,852571,"13240 SE 272ND ST, KENT, WA, 98042, UNITED STATES",Administratively Dissolved,False,False,False
1634,B&E INVESTMENTS LLC,NEYHART CABIN REAL ESTATE INVESTMENT LIMITED LIABILITYCOMPANY,602 322 758,341313,"417 NW 163RD ST, SHORELINE, WA, 98177-3725, UNITED STATES",Active,True,False,False
1635,B&E INVESTMENTS LLC,"NIERENBERG INVESTMENT MANAGEMENT COMPANY, INC.",601 621 541,341766,"19605 NE 8TH ST, CAMAS, WA, 98607-9252, UNITED STATES",Active,False,False,False
1636,B&E INVESTMENTS LLC,NIMBLE INVESTMENTS LLC,604 928 749,1569362,"100 N HOWARD ST STE W, SPOKANE, WA, 99201-0508, UNITED STATES",Active,True,False,False
1637,B&E INVESTMENTS LLC,"NL BEELS INVESTMENTS, LLC",604 316 619,1230080,"4030 SE KAMILCHE POINT RD, SHELTON, WA, 98584-7953, UNITED STATES",Administratively Dissolved,False,False,False
1638,B&E INVESTMENTS LLC,NOBLE AUTO INVESTMENTS LLC,603 446 330,871758,"15 NE MAIN AVE, WILBUR, WA, 99185, UNITED STATES",Administratively Dissolved,True,False,False
1639,B&E INVESTMENTS LLC,NOBLE CONSULTING AND INVESTMENTS CORP,602 222 490,863555,"18123 SE 279TH PL, COVINGTON, WA, 98042-5349, UNITED STATES",Active,False,False,False
1640,B&E INVESTMENTS LLC,NOBLE FAMILY INVESTMENTS LLC,604 633 089,1375374,"5827 CLOVER VALLEY RD SE, PORT ORCHARD, WA, 98367-9082, UNITED STATES",Administratively Dissolved,False,False,False
1641,B&E INVESTMENTS LLC,NOBLE GROUP INVESTMENTS LLC,604 777 795,1475555,"1413 233RD AVE NE, SAMMAMISH, WA, 98074-4473, UNITED STATES",Active,False,False,False
1642,B&E INVESTMENTS LLC,"NOBLE HORIZON INVESTMENTS GP, LLC",604 192 501,1164392,"1535 WEST LOOP S STE 450, HOUSTON, TX, 77027-9510, UNITED STATES",Administratively Dissolved,True,False,False
1643,B&E INVESTMENTS LLC,"NOBLE HORIZON INVESTMENTS, LIMITED PARTNERSHIP",604 192 504,1164395,"1535 WEST LOOP S STE 450, HOUSTON, TX, 77027-9510, UNITED STATES",Administratively Dissolved,True,False,False
1644,B&E INVESTMENTS LLC,"NOBLE INVESTMENT ENTERPRISE, LLC",603 102 372,351993,"211 BELLEVUE WAY NE, BELLEVUE, WA, 98004-5721, UNITED STATES",Active,False,False,False
1645,B&E INVESTMENTS LLC,NOBLE INVESTMENT LLC,603 527 581,847593,"620 86TH AVE NE, MEDINA, WA, 98039-5312, UNITED STATES",Active,True,False,False
1646,B&E INVESTMENTS LLC,"NOBLE INVESTMENTS LP, A LIMITED PARTNERSHIP",602 270 371,891610,,Inactive,True,False,False
1647,B&E INVESTMENTS LLC,"NOBLE METALS INVESTMENT GROUP, INC.",603 158 087,847594,"4034 POPLAR WAY, LONGVIEW, WA, 98632, UNITED STATES",Terminated,False,False,False
1648,B&E INVESTMENTS LLC,"NOBLE OAK INVESTMENTS, LLC",604 547 250,1325162,"2222 NE 179TH ST, RIDGEFIELD, WA, 98642-5528, UNITED STATES",Administratively Dissolved,False,False,False
1649,B&E INVESTMENTS LLC,"NOBLEHOUSE INVESTMENTS, LLC",602 912 266,840993,"21920 76TH AVE W SUITE 202, EDMONDS, WA, 98026-7980, UNITED STATES",Active,False,False,False
1650,B&E INVESTMENTS LLC,"NOHBELL INVESTMENT, LLC",604 028 394,868272,"2800 156TH AVE SE #200, BELLEVUE, WA, 98007, UNITED STATES",Voluntarily Dissolved,False,False,False
1651,B&E INVESTMENTS LLC,NORDBERG INVESTMENT GROUP LLC,604 495 297,1316304,,,True,True,True
1652,B&E INVESTMENTS LLC,NORTH BEND HOTEL INVESTMENT CO. L.L.C.,602 814 335,1136520,"1233 S SUNSET DR, TACOMA, WA, 98465, UNITED STATES",Administratively Dissolved,False,False,False
1653,B&E INVESTMENTS LLC,"NORTH BEND INVESTMENTS, L.L.C",603 113 788,344829,"14017 SE 139TH ST, RENTON, WA, 98059-5435, UNITED STATES",Voluntarily Dissolved,False,False,False
1654,B&E INVESTMENTS LLC,NORTH WHIDBEY INVESTMENTS LLC,602 489 294,353653,"460 SPECIAL PL, OAK HARBOR, WA, 98277-9498, UNITED STATES",Active,False,False,False
1655,B&E INVESTMENTS LLC,"NORTHBEACH INVESTMENT COMPANY, INC.",600 520 072,858419,,Administratively Dissolved,True,False,False
1656,B&E INVESTMENTS LLC,"NORTHWEST BOULEVARD INVESTMENT COMPANY, L.L.C.",602 244 816,896901,"617 N ASH ST, SPOKANE, WA, 99201-1806, UNITED STATES",Active,False,False,False
1657,B&E INVESTMENTS LLC,NORTHWEST BUILDERS & INVESTMENT LLC,603 552 412,876533,"14396 BANDIX RD SE, OLALLA, WA, 98359-9419, UNITED STATES",Active,False,False,False
1658,B&E INVESTMENTS LLC,NOTABLE INVESTMENTS LLC,604 388 375,1256704,"15609 11TH AVE SW, BURIEN, WA, 98166-2113, UNITED STATES",Active,False,False,False
1659,B&E INVESTMENTS LLC,NUDELMAN & AYZENBERG INVESTMENT COMPANY LLC,603 044 874,880180,"81 OAK RD, PORT HADLOCK, WA, 98339-9731, UNITED STATES",Voluntarily Dissolved,False,False,False
1660,B&E INVESTMENTS LLC,"NUMBER ONE INVESTMENT MANAGEMENT, LLC",602 625 366,876981,"2634 231ST PL SE, SAMMAMISH, WA, 98075, UNITED STATES",Active,False,False,False
1661,B&E INVESTMENTS LLC,"NW QUIMBY STREET INVESTMENTS, LLC",604 048 385,903194,"705 MAIN ST, VANCOUVER, WA, 98660-3161, UNITED STATES",Active,False,False,False
1662,B&E INVESTMENTS LLC,NYBERG INVESTMENT LLC,601 969 202,859944,,Voluntarily Dissolved,True,False,False
1663,B&E INVESTMENTS LLC,O'BOYLE INVESTMENT GROUP LLC,602 757 474,358398,"1412 8TH AVE W, SEATTLE, WA, 98119-3221, UNITED STATES",Administratively Dissolved,False,False,False
1664,B&E INVESTMENTS LLC,O'BRIEN INVESTMENT COMPANY,602 880 050,860046,"3829C S EDMUNDS ST, SEATTLE, WA, 98118-1729, UNITED STATES",Active,False,False,False
1665,B&E INVESTMENTS LLC,O'BRIEN-STEWART INVESTMENT GROUP LLC,604 637 094,1377009,"13324 E CATALDO AVE, SPOKANE VALLEY, WA, 99216-1011, UNITED STATES",Voluntarily Dissolved,False,False,False
1666,B&E INVESTMENTS LLC,"OAK AND BEAM INVESTMENTS, LLC",604 474 615,1295475,"9712 10TH AVE E, TACOMA, WA, 98445-3104, UNITED STATES",Active,False,False,False
1667,B&E INVESTMENTS LLC,"OAK HARBOR CINEMAS INVESTMENT HOLDINGS, LLC",603 376 471,904684,"558 PEBBLE BEACH DR, COUPEVILLE, WA, 98239-3027, UNITED STATES",Active,False,False,False
1668,B&E INVESTMENTS LLC,OAKWOOD RENEWABLE INVESTMENTS LLC,604 198 398,1168732,"1244 FEDERAL AVE E, SEATTLE, WA, 98102-4330, UNITED STATES",Active,False,False,False
1669,B&E INVESTMENTS LLC,"OBERMEYER WOOD INVESTMENT COUNSEL, LLLP",604 951 747,1582879,"100 N HOWARD ST STE W, SPOKANE, WA, 99201-0508, UNITED STATES",Active,True,False,False
1670,B&E INVESTMENTS LLC,OBSIDIAN REAL ESTATE INVESTMENT LLC,603 602 979,853705,"1648 NE 168TH ST, SHORELINE, WA, 98155, UNITED STATES",Administratively Dissolved,False,False,False
1671,B&E INVESTMENTS LLC,OCEAN BLUE INVESTMENTS L.L.C.,602 306 868,853807,"2136 SUNRISE CIR, WENATCHEE, WA, 98801-1047, UNITED STATES",Active,False,False,False
1672,B&E INVESTMENTS LLC,"OCTOBER INVESTMENTS, LLC",603 447 239,351767,"7715 KERBAUGH RD NE, OLYMPIA, WA, 98516-9535, UNITED STATES",Active,False,False,False
1673,B&E INVESTMENTS LLC,"OCTOBRE INVESTMENTS, LLC",602 687 461,867917,"18312 SE 43RD LANE, VANCOUVER, WA, 98683, UNITED STATES",Administratively Dissolved,False,False,False
1674,B&E INVESTMENTS LLC,"OLSON BROTHERS INVESTMENT, INC.",602 911 034,227715,"6622 112TH ST E, PUYALLUP, WA, 98373, UNITED STATES",Active,False,False,False
1675,B&E INVESTMENTS LLC,"OLTMAN BROTHERS INVESTMENTS, LLC",603 593 685,1138180,"2501 MOE RD, ELLENSBURG, WA, 98926-8426, UNITED STATES",Active,False,False,False
1676,B&E INVESTMENTS LLC,"ORION PORTFOLIO SOLUTIONS, LLC",605 009 441,1622172,"17605 WRIGHT ST, OMAHA, NE, 68130-2095, UNITED STATES",Active,False,True,True
1677,B&E INVESTMENTS LLC,OSBORNE LEASE & INVESTMENT CO.,600 074 519,872527,,Administratively Dissolved,True,False,False
1678,B&E INVESTMENTS LLC,P&B REAL ESTATE INVESTMENTS LLC,601 777 200,915199,,Terminated,True,False,False
1679,B&E INVESTMENTS LLC,"PACIFIC BLUE INVESTMENTS, LLC",602 435 619,887079,"479 ELLSWORTH ST #1, FRIDAY HARBOR, WA, 98250, UNITED STATES",Active,False,False,False
1680,B&E INVESTMENTS LLC,"PACIFIC BUSINESS INVESTMENTS, LLC",604 599 905,1350733,"8543 MIDVALE AVE N, SEATTLE, WA, 98103-4163, UNITED STATES",Administratively Dissolved,False,False,False
1681,B&E INVESTMENTS LLC,"PACIFIC MOBILE INVESTMENT GROUP, L.L.C.",601 794 216,364750,,Inactive,True,False,False
1682,B&E INVESTMENTS LLC,"PACIFIC TIMBER INVESTMENTS, LLC DBA PACIFIC TIMBER          INVESTMENTS, L.L.C.",601 713 097,879162,,Terminated,True,False,False
1683,B&E INVESTMENTS LLC,"PAINTED TABLE INVESTMENTS, LLC",603 622 362,363628,"14410 80TH ST E, PUYALLUP, WA, 98372, UNITED STATES",Active,False,False,False
1684,B&E INVESTMENTS LLC,"PARKER, CLARK AND NEWBERRY INVESTMENTS, LLC",602 791 039,391884,"8116 160TH STREET SE, SNOHOMISH, WA, 98296, UNITED STATES",Administratively Dissolved,False,False,False
1685,B&E INVESTMENTS LLC,"PAULA BEGOUN INVESTMENTS, LLC",602 422 834,898090,"13075 GATEWAY DR #160, SEATTLE, WA, 98168, UNITED STATES",Administratively Dissolved,False,False,False
1686,B&E INVESTMENTS LLC,PB & LUTHER INVESTMENTS LLC,604 417 742,1272313,"1621 W PINEHILL RD, SPOKANE, WA, 99218-2948, UNITED STATES",Administratively Dissolved,False,False,False
1687,B&E INVESTMENTS LLC,PB COOPER INVESTMENTS LLLP,603 129 743,901718,"10398 W BELFAIR VALLEY RD, BREMERTON, WA, 98312, UNITED STATES",Active,False,False,False
1688,B&E INVESTMENTS LLC,"PCAMPBELL INVESTMENTS, LLC",603 551 553,901842,"2515 PARK PL N, RENTON, WA, 98056-2569, UNITED STATES",Active,False,False,False
1689,B&E INVESTMENTS LLC,PEAK TO BEACH INVESTMENTS LLC,602 936 115,902640,"4125 161ST AVE SE, BELLEVUE, WA, 98006-1857, UNITED STATES",Administratively Dissolved,False,False,False
1690,B&E INVESTMENTS LLC,PEBBLES INVESTMENT LLC,604 878 817,1536872,"2807 NW 133RD ST, VANCOUVER, WA, 98685-2369, UNITED STATES",Active,False,False,False
1691,B&E INVESTMENTS LLC,"PEEBLES INVESTMENTS, LLC",602 615 794,888356,"10 RIVERVIEW CEMETERY RD, PO BOX 523, CHELAN, WA, 98816, UNITED STATES",Administratively Dissolved,False,False,False
1692,B&E INVESTMENTS LLC,"PEMBERTON INVESTMENTS, LLC",602 663 163,888759,"2411 STEPTOE ST, RICHLAND, WA, 99352-8519, UNITED STATES",Administratively Dissolved,False,False,False
1693,B&E INVESTMENTS LLC,"PENINSULA SUNBELT INVESTMENTS, L.L.C.",602 738 412,239079,"3215 NW 80TH ST, SEATTLE, WA, 98117, UNITED STATES",Inactive,False,False,False
1694,B&E INVESTMENTS LLC,PEPPER BRIDGE INVESTMENTS LLC,604 934 762,1575987,"701 5TH AVE STE 6100, SEATTLE, WA, 98104-7043, UNITED STATES",Active,False,False,False
1695,B&E INVESTMENTS LLC,PETTIBONE FAMILY INVESTMENTS LIMITED PARTNERSHIP,601 715 509,933416,,Inactive,True,False,False
1696,B&E INVESTMENTS LLC,"PHIL BEE INVESTMENTS, LLC",604 108 116,397937,"632 BRIARWOOD DR, E WENATCHEE, WA, 98802-8300, UNITED STATES",Active,False,False,False
1697,B&E INVESTMENTS LLC,PHOENIX BUILDERS INVESTMENT GROUP LLC,604 670 866,1402895,"5321 W 10TH AVE, KENNEWICK, WA, 99336-9312, UNITED STATES",Administratively Dissolved,False,False,False
1698,B&E INVESTMENTS LLC,PINEBRIDGE INVESTMENTS LLC,604 378 141,1251446,"517 W 13TH AVE, SPOKANE, WA, 99204-3713, UNITED STATES",Active,False,False,False
1699,B&E INVESTMENTS LLC,PLATT & BUESCHER INVESTMENTS LLC,602 520 004,909584,"180 NW COVELAND ST, COUPEVILLE, WA, 98239-0727, UNITED STATES",Active,False,False,False
1700,B&E INVESTMENTS LLC,PM BROTHERS INVESTMENT LLC,603 079 323,939414,"1243  SW 354TH PL, FEDERAL WAY, WA, 98023, UNITED STATES",Voluntarily Dissolved,False,False,False
1701,B&E INVESTMENTS LLC,PREMIER BUILDERS INVESTMENTS LLC,603 061 534,406547,"413 29TH ST NE SUITE C, PUYALLUP, WA, 98372, UNITED STATES",Administratively Dissolved,False,False,False
1702,B&E INVESTMENTS LLC,"PUENTES BROTHERS INVESTMENTS, LLC",601 833 605,908954,"3060 INDUSTRIAL WAY S, SALEM, OR, 97303",Terminated,False,False,False
1703,B&E INVESTMENTS LLC,"R&B EAGLE INVESTMENTS, INC",604 162 356,397073,"4902 122ND PL NE, MARYSVILLE, WA, 98271, UNITED STATES",Administratively Dissolved,False,False,False
1704,B&E INVESTMENTS LLC,R&B EXECUTIVE INVESTMENTS-KENT ASSOCIATES LIMITEDPARTNERSHIP,602 034 603,388386,,Terminated,True,False,False
1705,B&E INVESTMENTS LLC,R&B PROPERTY INVESTMENTS LLC,604 673 890,1409158,"1911 NW 146TH ST, VANCOUVER, WA, 98685-8008, UNITED STATES",Active,False,False,False
1706,B&E INVESTMENTS LLC,"RAABE FAMILY INVESTMENTS, LLC",603 301 859,956772,"6316 S AUER STREET, SPOKANE, WA, 99223, UNITED STATES",Active,False,False,False
1707,B&E INVESTMENTS LLC,RAABE SETTRAX INVESTMENTS LIMITED LIABILITY COMPANY,603 621 092,956773,"6316 S AUER ST, SPOKANE, WA, 99223, UNITED STATES",Active,False,False,False
1708,B&E INVESTMENTS LLC,RABBIT HOLE INVESTMENTS LLC,604 719 651,1436416,"25004 35TH AVE S, KENT, WA, 98032-4122, UNITED STATES",Active,False,False,False
1709,B&E INVESTMENTS LLC,"RAINBOW PINE TREE INVESTMENTS, LLC",603 184 877,917074,"11120 NE 2ND ST STE 100, BELLEVUE, WA, 98004-5848, UNITED STATES",Active,False,False,False
1710,B&E INVESTMENTS LLC,"RAINBOW REAL ESTATE INVESTMENT CO., L.L.C.",602 034 053,925156,"12819 SE 38TH ST # 483, BELLEVUE, WA, 98006-1326, UNITED STATES",Active,False,False,False
1711,B&E INVESTMENTS LLC,"RAINBOW RIVER INVESTMENTS, LP",603 503 979,417966,"316 LINEHAM ACRES DR NW, HIGH RIVER, AB CANADA, FO, 00000, UNITED STATES",Administratively Dissolved,False,False,False
1712,B&E INVESTMENTS LLC,"RAINIER BEACH INVESTMENT GROUP, LLC",604 390 485,1261875,"4813B S FLETCHER ST, SEATTLE, WA, 98118-5302, UNITED STATES",Administratively Dissolved,False,False,False
1713,B&E INVESTMENTS LLC,RAMBERG INVESTMENTS LLC,604 983 286,1609077,"6913 NE 126TH ST, VANCOUVER, WA, 98686-3469, UNITED STATES",Active,False,False,False
1714,B&E INVESTMENTS LLC,"RANDS BROTHERS INVESTMENTS, LLC",603 403 850,954100,"26132 HIGHWAY 2, SANDPOINT, ID, 83864-6353, UNITED STATES",Administratively Dissolved,False,False,False
1715,B&E INVESTMENTS LLC,RASPBERRY INVESTMENTS LLC,601 742 196,939878,"937 HARVARD AVE E, SEATTLE, WA, 98102-4532, UNITED STATES",Withdrawn,False,False,False
1716,B&E INVESTMENTS LLC,RASPBERRY PIE INVESTMENT LLC,604 922 813,1564317,"1673 PENN COVE RD, OAK HARBOR, WA, 98277-7612, UNITED STATES",Active,False,False,False
1717,B&E INVESTMENTS LLC,"RATCLIFFE-BAKER INVESTMENT COMPANY, LLC",602 720 274,939903,"21421 SNAG ISLAND DRIVE E, LAKE TAPPS, WA, 98391, UNITED STATES",Administratively Dissolved,False,False,False
1718,B&E INVESTMENTS LLC,"RBRE INVESTMENTS, LLC",604 385 912,1254695,"11215 13TH ST E, EDGEWOOD, WA, 98372-1444, UNITED STATES",Active,False,False,False
1719,B&E INVESTMENTS LLC,"RDB SECURITY INVESTMENTS, LLC",603 190 055,940924,"45 COUNTRY CLUB DR SW, LAKEWOOD, WA, 98498, UNITED STATES",Administratively Dissolved,False,False,False
1720,B&E INVESTMENTS LLC,"RDC BELLINGHAM INVESTMENTS, LLC",603 527 539,395647,"14850 MONTFORT DR, STE 185, DALLAS, TX, 75254-1423, UNITED STATES",Terminated,False,False,False
1721,B&E INVESTMENTS LLC,"REAL BADGER PROPERTY INVESTMENTS-KENT, LLC",603 606 581,900990,"1405 CENTRAL AVE S, KENT, WA, 98032-7421, UNITED STATES",Active,False,False,False
1722,B&E INVESTMENTS LLC,"REASONABLE INVESTMENTS, LLC",603 503 027,957210,"104009 S 292 PR SW, PROSSER, WA, 99350-9404, UNITED STATES",Active,False,False,False
1723,B&E INVESTMENTS LLC,REBBECCAPOTTERREINVESTMENTS LLC,604 719 694,1439053,"10002 NE 13TH AVE STE 110, VANCOUVER, WA, 98686-5507, UNITED STATES",Delinquent,False,False,False
1724,B&E INVESTMENTS LLC,REBEL FIREARMS LLC A DIVISION OF WOODFORD INVESTMENTS,604 918 329,1561446,"2920 N OAKES ST, TACOMA, WA, 98407-6349, UNITED STATES",Active,False,False,False
1725,B&E INVESTMENTS LLC,"REBER INVESTMENTS, LLC",604 028 790,919078,"7895 SE CYPRESS AVE, MILWAUKIE, OR, 97267-3406, UNITED STATES",Withdrawn,False,False,False
1726,B&E INVESTMENTS LLC,"REDDING BROTHERS INVESTMENT CO., L.L.C.",601 786 665,406691,"3531 W HORIZON AVE, SPOKANE, WA, 99208-8494, UNITED STATES",Active,False,False,False
1727,B&E INVESTMENTS LLC,REDMOND SUSTAINABLE INVESTMENTS LLC,603 568 140,1144728,"11525 N DOGWOOD LN, WOODWAY, WA, 98020-6131, UNITED STATES",Active,True,False,False
1728,B&E INVESTMENTS LLC,"REDONDO BEACH INVESTMENTS, LLC",604 356 297,1245043,"3225 MCLEOD DR STE 100, LAS VEGAS, NV, 89121-2257, UNITED STATES",Voluntarily Dissolved,True,False,False
1729,B&E INVESTMENTS LLC,RELIABLE INVESTMENTS LLC,603 217 431,930769,"707 S GRADY WAY, SUITE 600, RENTON, WA, 98057-3227, UNITED STATES",Active,False,False,False
1730,B&E INVESTMENTS LLC,RELIABLE INVESTMENTS LLC,602 157 288,403780,"1627 121ST AVE SE, BELLEVUE, WA, 98005-3806, UNITED STATES",Active,False,False,False
1731,B&E INVESTMENTS LLC,RELIABLE REAL ESTATE INVESTMENTS LLC,605 170 601,1651847,"3011 NE 43RD ST, VANCOUVER, WA, 98663-2107, UNITED STATES",Active,False,False,False
